Symbol,Name,Last Sale,Net Change,% Change,Market Cap,Country,IPO Year,Volume,Sector,Industry
AACG,ATA Creativity Global American Depositary Shares,$3.83,-0.16,-4.01%,120072419.00,China,,105888,Consumer Services,Other Consumer Services
AACQ,Artius Acquisition Inc. Class A Common Stock,$10.30,0.12,1.179%,932793750.00,United States,2020,330588,Basic Industries,Major Chemicals
AACQU,Artius Acquisition Inc. Unit ,$10.7567,0.00,0.00%,0.00,United States,2020,61,Basic Industries,Major Chemicals
AACQW,Artius Acquisition Inc Warrant,$1.99,0.08,4.188%,0.00,United States,2020,53684,Basic Industries,Major Chemicals
AAL,American Airlines Group Inc. Common Stock,$23.958,-0.102,-0.424%,15366049672.00,United States,,14974734,Transportation,Air Freight/Delivery Services
AAME,Atlantic American Corporation Common Stock,$3.9799,-0.0501,-1.243%,81250626.00,United States,,273068,Finance,Life Insurance
AAOI,Applied Optoelectronics Inc. Common Stock,$8.47,0.00,0.00%,226146061.00,United States,2013,139747,Technology,Semiconductors
AAON,AAON Inc. Common Stock,$70.14,-0.41,-0.581%,3676135526.00,United States,,20492,Capital Goods,Industrial Machinery/Components
AAPL,Apple Inc. Common Stock,$127.1812,0.9712,0.77%,2204983706008.00,United States,1980,36693165,Technology,Computer Manufacturing
AAWW,Atlas Air Worldwide Holdings NEW Common Stock,$61.85,-2.36,-3.675%,1781140652.00,United States,,188393,Transportation,Transportation Services
ABCB,Ameris Bancorp Common Stock,$51.67,-1.20,-2.27%,3597212335.00,United States,1994,111969,Finance,Major Banks
ABCL,AbCellera Biologics Inc. Common Shares,$29.075,0.075,0.259%,7835647605.00,Canada,2020,505565,Health Care,Major Pharmaceuticals
ABCM,Abcam plc American Depositary Shares,$19.67,-0.02,-0.102%,4459678272.00,United Kingdom,2020,170665,Health Care,Biotechnology: Biological Products (No Diagnostic Substances)
ABEO,Abeona Therapeutics Inc. Common Stock,$1.685,-0.015,-0.882%,166459352.00,United States,,633059,Health Care,Major Pharmaceuticals
ABGI,ABG Acquisition Corp. I Class A Ordinary Shares,$9.91,-0.03,-0.302%,191585571.00,United States,2021,10518,Finance,Business Services
ABIO,ARCA biopharma Inc. Common Stock,$3.59,-0.07,-1.913%,51732413.00,United States,,87079,Health Care,Biotechnology: In Vitro & In Vivo Diagnostic Substances
ABMD,ABIOMED Inc. Common Stock,$318.89,-4.73,-1.462%,14423702748.00,United States,,29354,Health Care,Medical/Dental Instruments
ABNB,Airbnb Inc. Class A Common Stock,$182.7699,-7.2601,-3.821%,109003786869.00,United States,2020,2623979,Finance,Diversified Commercial Services
ABST,Absolute Software Corporation Common Stock,$13.98,-0.23,-1.619%,686652263.00,Canada,2020,31092,Technology,Computer Software: Prepackaged Software
ABTX,Allegiance Bancshares Inc. Common Stock,$40.31,-0.43,-1.055%,812930480.00,United States,2015,4271,Finance,Major Banks
ABUS,Arbutus Biopharma Corporation Common Stock,$3.2695,-0.0905,-2.693%,316317308.00,Canada,,304412,Health Care,Major Pharmaceuticals
ACAC,Acies Acquisition Corp. Class A Ordinary Share,$9.96,0.005,0.05%,267986250.00,United States,2020,41763,Technology,Computer Software: Prepackaged Software
ACACU,Acies Acquisition Corp. Unit,$10.65,0.2709,2.61%,0.00,United States,2020,197,Technology,Computer Software: Prepackaged Software
ACACW,Acies Acquisition Corp. Warrant,$1.6001,0.0001,0.006%,0.00,United States,2020,1608,Technology,Computer Software: Prepackaged Software
ACAD,ACADIA Pharmaceuticals Inc. Common Stock,$21.17,0.53,2.568%,3388204940.00,United States,1985,1901425,Health Care,Major Pharmaceuticals
ACAHU,Atlantic Coastal Acquisition Corp. Unit,$9.9725,0.0025,0.025%,0.00,United States,2021,24582,Finance,Business Services
ACBAU,Ace Global Business Acquisition Limited Unit,$10.09,0.02,0.199%,0.00,Hong Kong,2021,49958,Finance,Business Services
ACBI,Atlantic Capital Bancshares Inc. Common Stock,$24.57,0.04,0.163%,500552497.00,United States,,14568,Finance,Major Banks
ACCD,Accolade Inc. Common Stock,$47.16,-1.58,-3.242%,2742043734.00,United States,2020,232406,,
ACER,Acer Therapeutics Inc. Common Stock (DE),$3.01,-0.12,-3.834%,43073834.00,United States,,46923,Health Care,Major Pharmaceuticals
ACET,Adicet Bio Inc. Common Stock ,$12.99,-0.02,-0.154%,254471866.00,United States,2018,19370,Health Care,Major Pharmaceuticals
ACEV,ACE Convergence Acquisition Corp. Class A Ordinary Shares,$9.99,-0.02,-0.20%,287212500.00,United States,2020,760967,Technology,Semiconductors
ACEVU,ACE Convergence Acquisition Corp. Unit,$11.1199,0.00,0.00%,0.00,United States,2020,10,Technology,Semiconductors
ACEVW,ACE Convergence Acquisition Corp. Warrant,$2.08,-0.07,-3.256%,0.00,United States,2020,4053,Technology,Semiconductors
ACGL,Arch Capital Group Ltd. Common Stock,$39.78,-0.15,-0.376%,16042338931.00,Bermuda,,397316,Finance,Property-Casualty Insurers
ACGLO,Arch Capital Group Ltd. Depositary Shares Each Representing 1/1000th Interest in a Share of 5.45% Non-Cumulative Preferred Shares Series F,$26.54,0.01,0.038%,0.00,Bermuda,,3856,Finance,Property-Casualty Insurers
ACGLP,Arch Capital Group Ltd. Depositary Shares Representing Interest in 5.25% Non-Cumulative Preferred Series E Shrs,$25.78,-0.02,-0.078%,0.00,Bermuda,,4798,Finance,Property-Casualty Insurers
ACHC,Acadia Healthcare Company Inc. Common Stock,$57.66,-0.94,-1.604%,5155467955.00,United States,,79045,Health Care,Medical Specialities
ACHL,Achilles Therapeutics plc American Depositary Shares,$15.94,-1.92,-10.75%,647510711.00,United Kingdom,2021,80714,Health Care,Biotechnology: Biological Products (No Diagnostic Substances)
ACHV,Achieve Life Sciences Inc. Common Shares,$11.05,-0.11,-0.986%,67956583.00,United States,,12522,Health Care,Biotechnology: In Vitro & In Vivo Diagnostic Substances
ACIU,AC Immune SA Common Stock,$7.15,0.06,0.846%,519817262.00,Switzerland,2016,55744,Health Care,Major Pharmaceuticals
ACIW,ACI Worldwide Inc. Common Stock,$39.07,-0.31,-0.787%,4576759702.00,United States,,111378,Technology,Computer Software: Prepackaged Software
ACKIT,Ackrell SPAC Partners I Co. Subunits,$9.95,0.04,0.404%,0.00,United States,2021,5724,Finance,Business Services
ACKIU,Ackrell SPAC Partners I Co. Units,$10.1514,-0.0786,-0.768%,0.00,United States,2020,990,Finance,Business Services
ACKIW,Ackrell SPAC Partners I Co. Warrants,$0.5299,-0.0301,-5.375%,0.00,United States,2021,5200,Finance,Business Services
ACLS,Axcelis Technologies Inc. Common Stock,$47.8268,-0.5732,-1.184%,1615329078.00,United States,2000,111437,Technology,Industrial Machinery/Components
ACMR,ACM Research Inc. Class A Common Stock,$88.37,-0.63,-0.708%,1656321915.00,United States,2017,50706,Technology,Industrial Machinery/Components
ACNB,ACNB Corporation Common Stock,$29.545,-0.215,-0.722%,257485266.00,United States,,1640,Finance,Major Banks
ACOR,Acorda Therapeutics Inc. Common Stock,$4.71,-0.09,-1.875%,44697302.00,United States,2006,31826,Health Care,Biotechnology: Biological Products (No Diagnostic Substances)
ACQRU,Independence Holdings Corp. Units,$10.03,0.04,0.40%,0.00,United States,2021,14450,Finance,Business Services
ACRS,Aclaris Therapeutics Inc. Common Stock,$28.75,-0.23,-0.794%,1489372418.00,United States,2015,139451,Health Care,Major Pharmaceuticals
ACRX,AcelRx Pharmaceuticals Inc. Common Stock,$1.519,-0.041,-2.628%,180681754.00,United States,2011,522245,Health Care,Major Pharmaceuticals
ACST,Acasti Pharma Inc. Class A Common Stock,$0.5347,-0.0353,-6.193%,51808440.00,Canada,,6214077,Health Care,Major Pharmaceuticals
ACTC,ArcLight Clean Transition Corp. Class A Ordinary Shares,$17.525,-0.475,-2.639%,607898438.00,United States,2020,193438,Capital Goods,Auto Manufacturing
ACTCU,ArcLight Clean Transition Corp. Unit,$20.72,-0.01,-0.048%,0.00,United States,2020,552,Capital Goods,Auto Manufacturing
ACTCW,ArcLight Clean Transition Corp. Warrant,$6.40,0.00,0.00%,0.00,United States,2020,60129,Capital Goods,Auto Manufacturing
ACTDU,ArcLight Clean Transition Corp. II Unit,$10.08,0.04,0.398%,0.00,United States,2021,6970,Finance,Business Services
ACTG,Acacia Research Corporation (Acacia Tech) Common Stock,$6.16,-0.13,-2.067%,303561430.00,United States,,139784,Miscellaneous,Multi-Sector Companies
ACVA,ACV Auctions Inc. Class A Common Stock,$31.81,-0.38,-1.18%,4903545314.00,United States,2021,57830,Miscellaneous,Business Services
ADAG,Adagene Inc. American Depositary Shares,$17.115,-0.635,-3.577%,721907619.00,China,2021,5039,Health Care,Major Pharmaceuticals
ADAP,Adaptimmune Therapeutics plc American Depositary Shares,$4.99,-0.28,-5.313%,774138346.00,United Kingdom,2015,545574,Health Care,Biotechnology: Biological Products (No Diagnostic Substances)
ADBE,Adobe Inc. Common Stock,$491.76,0.42,0.085%,235061280000.00,United States,1986,529708,Technology,Computer Software: Prepackaged Software
ADER,26 Capital Acquisition Corp. Class A Common Stock,$9.83,0.00,0.00%,337906250.00,United States,2021,16,Finance,Business Services
ADERU,26 Capital Acquisition Corp. Unit,$10.2159,-0.0241,-0.235%,0.00,United States,2021,1232,Finance,Business Services
ADERW,26 Capital Acquisition Corp. Warrant,$0.9299,0.0699,8.128%,0.00,United States,2021,7447,Finance,Business Services
ADES,Advanced Emissions Solutions Inc. Common Stock,$5.53,-0.04,-0.718%,102409218.00,United States,,54988,Basic Industries,Major Chemicals
ADI,Analog Devices Inc. Common Stock,$159.12,-2.59,-1.602%,58779494785.00,United States,,670628,Technology,Semiconductors
ADIL,Adial Pharmaceuticals Inc Common Stock,$2.45,-0.06,-2.39%,42311199.00,United States,2018,79196,Health Care,Major Pharmaceuticals
ADILW,Adial Pharmaceuticals Inc Warrant,$0.6501,-0.01,-1.515%,0.00,United States,2018,769,Health Care,Major Pharmaceuticals
ADMA,ADMA Biologics Inc Common Stock,$1.815,0.035,1.966%,220114773.00,United States,,561342,Health Care,Biotechnology: Biological Products (No Diagnostic Substances)
ADMP,Adamis Pharmaceuticals Corporation Common Stock,$0.8824,-0.0176,-1.956%,123782409.00,United States,,2069968,Health Care,Major Pharmaceuticals
ADMS,Adamas Pharmaceuticals Inc. Common Stock,$4.82,-0.12,-2.429%,207589789.00,United States,2014,57837,Health Care,Major Pharmaceuticals
ADN,Advent Technologies Holdings Inc. Class A Common Stock,$13.86,-0.08,-0.574%,283273563.00,United States,2018,60487,Miscellaneous,Industrial Machinery/Components
ADNWW,Advent Technologies Holdings Inc. Warrant,$2.45,-0.10,-3.922%,0.00,United States,2018,125370,Miscellaneous,Industrial Machinery/Components
ADOC,Edoc Acquisition Corp. Class A Ordinary Share,$10.05,0.02,0.199%,118630200.00,United States,2020,104,Finance,Business Services
ADOCR,Edoc Acquisition Corp. Right,$0.465,0.022,4.966%,0.00,United States,2020,10710,Finance,Business Services
ADOCW,Edoc Acquisition Corp. Warrant,$0.3599,0.0055,1.552%,0.00,United States,2020,4350,Finance,Business Services
ADP,Automatic Data Processing Inc. Common Stock,$187.055,-2.355,-1.243%,80048357852.00,United States,,511106,Technology,EDP Services
ADPT,Adaptive Biotechnologies Corporation Common Stock,$40.63,-1.88,-4.422%,5656488407.00,United States,2019,596668,Health Care,Biotechnology: Biological Products (No Diagnostic Substances)
ADSK,Autodesk Inc. Common Stock,$285.38,-0.12,-0.042%,62667248862.00,United States,,212106,Technology,Computer Software: Prepackaged Software
ADTN,ADTRAN Inc. Common Stock,$18.435,1.115,6.438%,893816256.00,United States,1994,179483,Public Utilities,Telecommunications Equipment
ADTX,ADiTx Therapeutics Inc. Common Stock,$2.71,-0.21,-7.192%,38277390.00,United States,2020,223953,Health Care,Major Pharmaceuticals
ADUS,Addus HomeCare Corporation Common Stock,$104.07,-0.44,-0.421%,1647041376.00,United States,2009,21927,Health Care,Medical/Nursing Services
ADV,Advantage Solutions Inc. Class A Common Stock,$12.50,0.01,0.08%,3980624575.00,United States,2019,88438,Miscellaneous,Business Services
ADVM,Adverum Biotechnologies Inc. Common Stock,$9.79,-0.10,-1.011%,957424093.00,United States,2014,239839,Health Care,Biotechnology: Biological Products (No Diagnostic Substances)
ADVWW,Advantage Solutions Inc. Warrant,$3.27,0.00,0.00%,0.00,United States,2019,5,Miscellaneous,Business Services
ADXN,Addex Therapeutics Ltd American Depositary Shares,$10.88,0.38,3.619%,61748907.00,Switzerland,,8046,Health Care,Major Pharmaceuticals
ADXS,Advaxis Inc. Common Stock,$0.7159,-0.0287,-3.854%,85526153.00,United States,,973512,Health Care,Major Pharmaceuticals
AEAC,Authentic Equity Acquisition Corp. Class A ordinary share,$9.705,0.035,0.362%,0.00,United States,2021,312888,Finance,Business Services
AEACU,Authentic Equity Acquisition Corp. Unit,$10.05,0.00,0.00%,0.00,United States,2021,9303,Finance,Business Services
AEACW,Authentic Equity Acquisition Corp. Warrant,$0.80,-0.02,-2.439%,0.00,United States,2021,8643,Finance,Business Services
AEGN,Aegion Corp Common Stock,$28.435,-0.035,-0.123%,874115188.00,United States,,53271,Basic Industries,Water Supply
AEHL,Antelope Enterprise Holdings Limited Common Stock (0.024 par),$3.102,-0.268,-7.953%,11465786.00,China,,293330,Capital Goods,Building Materials
AEHR,Aehr Test Systems Common Stock,$2.5225,-0.0775,-2.981%,59257379.00,United States,1997,53622,Capital Goods,Electrical Products
AEI,Alset EHome International Inc. Common Stock,$11.12,-0.08,-0.714%,95298400.00,United States,2020,466415,Finance,Real Estate
AEIS,Advanced Energy Industries Inc. Common Stock,$117.41,-2.13,-1.782%,4505693872.00,United States,1995,51512,Capital Goods,Industrial Machinery/Components
AEMD,Aethlon Medical Inc. Common Stock,$2.06,-0.03,-1.435%,24990441.00,United States,,13331,Health Care,Medical/Dental Instruments
AEP,American Electric Power Company Inc. Common Stock,$86.50,-0.27,-0.311%,42961252447.00,United States,,391588,Public Utilities,Electric Utilities: Central
AEPPL,American Electric Power Company Inc. Corporate Unit,$49.23,-0.04,-0.081%,0.00,United States,,20340,Public Utilities,Electric Utilities: Central
AEPPZ,American Electric Power Company Inc. Corporate Units,$50.165,-0.165,-0.328%,0.00,United States,,9084,Public Utilities,Electric Utilities: Central
AERI,Aerie Pharmaceuticals Inc. Common Stock,$17.73,0.37,2.131%,831840768.00,United States,2013,189122,Health Care,Biotechnology: Biological Products (No Diagnostic Substances)
AESE,Allied Esports Entertainment Inc. Common Stock,$2.85,-0.07,-2.397%,111547581.00,United States,2017,473405,Consumer Services,Services-Misc. Amusement & Recreation
AEY,ADDvantage Technologies Group Inc. Common Stock,$2.75,0.04,1.476%,34008131.00,United States,,14910,Consumer Services,Office Equipment/Supplies/Services
AEYE,AudioEye Inc. Common Stock,$29.03,0.37,1.291%,310786007.00,United States,,48002,Technology,Computer Software: Prepackaged Software
AEZS,Aeterna Zentaris Inc. Common Stock,$1.10,-0.01,-0.901%,133237264.00,Canada,,1835126,Health Care,Major Pharmaceuticals
AFAQU,AF Acquisition Corp. Units,$9.9479,0.00,0.00%,0.00,United States,2021,155,Finance,Business Services
AFBI,Affinity Bancshares Inc. Common Stock (MD),$12.15,-0.03,-0.246%,0.00,United States,2017,1446,Finance,Savings Institutions
AFCG,AFC Gamma Inc. Common Stock,$21.625,0.115,0.535%,289059040.00,United States,2021,40960,Finance,Real Estate
AFIB,Acutus Medical Inc. Common Stock,$13.44,-0.11,-0.812%,377596854.00,United States,2020,51806,Health Care,Medical/Dental Instruments
AFIN,American Finance Trust Inc. Class A Common Stock,$9.58,-0.25,-2.543%,1042660462.00,United States,,347722,Consumer Services,Real Estate Investment Trusts
AFINO,American Finance Trust Inc. 7.375% Series C Cumulative Redeemable Preferred Stock,$25.00,0.0101,0.04%,,United States,,32383,Consumer Services,Real Estate Investment Trusts
AFINP,American Finance Trust Inc. 7.50% Series A Cumulative Redeemable Perpetual Preferred Stock,$25.917,-0.053,-0.204%,0.00,United States,,12204,Consumer Services,Real Estate Investment Trusts
AFMD,Affimed N.V.,$7.79,-0.14,-1.765%,894185604.00,Germany,2014,407594,Health Care,Major Pharmaceuticals
AFRM,Affirm Holdings Inc. Class A Common Stock,$71.64,-1.36,-1.863%,18440669790.00,United States,2021,613521,Miscellaneous,Business Services
AFYA,Afya Limited Class A Common Shares,$20.02,-0.46,-2.246%,1865920516.00,Brazil,2019,127156,Consumer Services,Other Consumer Services
AGBA,AGBA Acquisition Limited Ordinary Share,$10.51,-0.045,-0.426%,56103536.00,Hong Kong,2019,59796,Finance,Business Services
AGBAR,AGBA Acquisition Limited Right,$0.3539,-0.0359,-9.21%,0.00,Hong Kong,2019,97996,Finance,Business Services
AGBAW,AGBA Acquisition Limited Warrant,$0.31,0.0001,0.032%,0.00,Hong Kong,2019,7600,Finance,Business Services
AGC,Altimeter Growth Corp. Class A Ordinary Shares,$13.20,0.50,3.937%,825000000.00,United States,2020,2874093,Finance,Business Services
AGCUU,Altimeter Growth Corp. Unit,$14.11,0.728,5.44%,0.00,United States,2020,120527,Finance,Business Services
AGCWW,Altimeter Growth Corp. Warrant,$4.5899,0.7899,20.787%,0.00,United States,2020,89535,Finance,Business Services
AGEN,Agenus Inc. Common Stock,$2.84,-0.05,-1.73%,581306598.00,United States,2000,828155,Health Care,Biotechnology: Biological Products (No Diagnostic Substances)
AGFS,AgroFresh Solutions Inc. Common Stock,$2.15,0.04,1.896%,112747681.00,United States,2014,18876,Basic Industries,Agricultural Chemicals
AGFY,Agrify Corporation Common Stock,$12.9799,-0.5201,-3.853%,263428810.00,United States,2021,189226,Consumer Non-Durables,Farming/Seeds/Milling
AGGRU,Agile Growth Corp. Units,$9.92,-0.02,-0.201%,0.00,United States,2021,1380,Finance,Business Services
AGIO,Agios Pharmaceuticals Inc. Common Stock,$53.79,-0.22,-0.407%,3743855648.00,United States,2013,252784,Health Care,Major Pharmaceuticals
AGLE,Aeglea BioTherapeutics Inc. Common Stock,$7.99,0.00,0.00%,383646977.00,United States,2016,41632,Health Care,Major Pharmaceuticals
AGMH,AGM Group Holdings Inc. Class A Ordinary Shares,$12.21,0.21,1.75%,352759782.00,Hong Kong,2018,365,Technology,EDP Services
AGNC,AGNC Investment Corp. Common Stock,$16.975,-0.035,-0.206%,9015798989.00,United States,2008,1017562,Consumer Services,Real Estate Investment Trusts
AGNCM,AGNC Investment Corp. Depositary Shares rep 6.875% Series D Fixed-to-Floating Cumulative Redeemable Preferred Stock,$25.66,0.05,0.195%,0.00,United States,,5453,Consumer Services,Real Estate Investment Trusts
AGNCN,AGNC Investment Corp. Depositary Shares Each Representing a 1/1000th Interest in a Share of 7.00% Series C Fixed-To-Floating Rate Cumulative Redeemable Preferred Stock,$25.68,0.04,0.156%,0.00,United States,,2117,Consumer Services,Real Estate Investment Trusts
AGNCO,AGNC Investment Corp. Depositary Shares each representing a 1/1000th interest in a share of 6.50% Series E Fixed-to-Floating Cumulative Redeemable Preferred Stock,$24.7999,-0.0301,-0.121%,0.00,United States,,27998,Consumer Services,Real Estate Investment Trusts
AGNCP,AGNC Investment Corp. Depositary Shares Each Representing a 1/1000th Interest in a Share of 6.125% Series F Fixed-to-Floating Rate Cumulative Redeemable Preferred Stock,$24.00,-0.06,-0.249%,0.00,United States,,37486,Consumer Services,Real Estate Investment Trusts
AGRX,Agile Therapeutics Inc. Common Stock,$2.03,-0.04,-1.932%,177886675.00,United States,2014,479178,Health Care,Major Pharmaceuticals
AGTC,Applied Genetic Technologies Corporation Common Stock,$4.653,-0.087,-1.835%,198926782.00,United States,2014,405054,Health Care,Biotechnology: Biological Products (No Diagnostic Substances)
AGYS,Agilysys Inc. Common Stock,$49.52,-1.54,-3.016%,1170531575.00,United States,,28269,Technology,EDP Services
AHAC,Alpha Healthcare Acquisition Corp. Class A Common Stock,$10.69,-0.01,-0.093%,137419950.00,United States,2020,40220,Finance,Business Services
AHACU,Alpha Healthcare Acquisition Corp. Unit,$11.9751,-0.2249,-1.843%,0.00,United States,2020,1159,Finance,Business Services
AHACW,Alpha Healthcare Acquisition Corp. Warrant,$2.89,-0.10,-3.344%,0.00,United States,2020,11939,Finance,Business Services
AHCO,AdaptHealth Corp. Class A Common Stock,$38.14,0.18,0.474%,4382225167.00,United States,2018,174028,Health Care,Medical/Nursing Services
AHPI,Allied Healthcare Products Inc. Common Stock,$5.06,0.20,4.115%,20308497.00,United States,1992,249591,Health Care,Industrial Specialties
AIH,Aesthetic Medical International Holdings Group Ltd. American Depositary Shares,$7.39,0.05,0.681%,174499257.00,China,2019,19596,Health Care,Medical Specialities
AIHS,Senmiao Technology Limited Common Stock,$1.44,0.04,2.857%,62436698.00,China,2018,715541,Finance,Finance: Consumer Services
AIKI,AIkido Pharma Inc. Common Stock,$1.1072,-0.0328,-2.877%,98436885.00,United States,,10836584,Health Care,Biotechnology: Commercial Physical & Biological Resarch
AIMC,Altra Industrial Motion Corp. Common Stock,$59.06,-0.70,-1.171%,3826530592.00,United States,2006,187453,Capital Goods,Industrial Machinery/Components
AINV,Apollo Investment Corporation Common Stock,$14.31,0.12,0.846%,933858809.00,United States,2004,104131,,
AIRG,Airgain Inc. Common Stock,$22.01,0.07,0.319%,227844725.00,United States,2016,27721,Technology,Radio And Television Broadcasting And Communications Equipment
AIRT,Air T Inc. Common Stock,$24.00,0.27,1.138%,69164472.00,United States,,587,Transportation,Air Freight/Delivery Services
AIRTP,Air T Inc. Air T Funding Alpha Income Trust Preferred Securities,$25.0842,0.00,0.00%,0.00,United States,,100,Transportation,Air Freight/Delivery Services
AIRTW,Air T Inc. Air T Funding Warrants to Purchase Alpha Income Trust Preferred Expiring 08/30/2021,$0.132,-0.028,-17.50%,0.00,United States,,21260,Transportation,Air Freight/Delivery Services
AKAM,Akamai Technologies Inc. Common Stock,$103.16,-0.58,-0.559%,16837803053.00,United States,1999,340339,Miscellaneous,Business Services
AKBA,Akebia Therapeutics Inc. Common Stock,$3.315,0.095,2.95%,508860572.00,United States,2014,3663903,Health Care,Major Pharmaceuticals
AKER,Akers Biosciences Inc. Common Stock,$3.32,0.08,2.469%,55287392.00,United States,2014,171046,Health Care,Biotechnology: In Vitro & In Vivo Diagnostic Substances
AKIC,Sports Ventures Acquisition Corp. Class A Ordinary Shares,$9.845,0.045,0.459%,289541450.00,United States,2021,1663,Finance,Business Services
AKICU,Sports Ventures Acquisition Corp. Unit,$10.04,-0.02,-0.199%,0.00,United States,2021,7000,Finance,Business Services
AKICW,Sports Ventures Acquisition Corp. Warrant,$0.76,0.00,0.00%,0.00,United States,2021,2174,Finance,Business Services
AKRO,Akero Therapeutics Inc. Common Stock,$28.48,0.15,0.529%,990258685.00,United States,2019,53962,Health Care,Major Pharmaceuticals
AKTS,Akoustis Technologies Inc. Common Stock,$12.34,-1.43,-10.385%,582982001.00,United States,,576316,Public Utilities,Telecommunications Equipment
AKTX,Akari Therapeutics plc ADR (0.01 USD),$2.58,-0.10,-3.731%,99261163.00,United Kingdom,,26871,Health Care,Major Pharmaceuticals
AKU,Akumin Inc. Common Shares,$3.32,0.05,1.529%,232992381.00,Canada,,9668,Health Care,Medical Specialities
AKUS,Akouos Inc. Common Stock,$14.19,-0.22,-1.527%,488164706.00,United States,2020,99841,Health Care,Major Pharmaceuticals
ALAC,Alberton Acquisition Corporation Ordinary Shares,$10.94,0.00,0.00%,50490704.00,Hong Kong,2018,30514,Basic Industries,Engineering & Construction
ALACR,Alberton Acquisition Corporation Rights exp April 26 2021,$0.5428,-0.0371,-6.398%,0.00,Hong Kong,2018,206974,Basic Industries,Engineering & Construction
ALACU,Alberton Acquisition Corporation Unit,$16.50,0.00,0.00%,0.00,Hong Kong,2018,49,Basic Industries,Engineering & Construction
ALACW,Alberton Acquisition Corporation Warrant,$0.512,-0.057,-10.018%,0.00,Hong Kong,2018,9007,Basic Industries,Engineering & Construction
ALBO,Albireo Pharma Inc. Common Stock,$33.89,-0.26,-0.761%,647760006.00,United States,,19562,Health Care,Major Pharmaceuticals
ALCO,Alico Inc. Common Stock,$29.00,-0.26,-0.889%,217888977.00,United States,,8917,Consumer Non-Durables,Farming/Seeds/Milling
ALDX,Aldeyra Therapeutics Inc. Common Stock,$12.62,0.12,0.96%,596255209.00,United States,2014,225483,Health Care,Major Pharmaceuticals
ALEC,Alector Inc. Common Stock,$18.92,-0.62,-3.173%,1505737643.00,United States,2019,105239,Health Care,Biotechnology: Biological Products (No Diagnostic Substances)
ALGM,Allegro MicroSystems Inc. Common Stock,$27.07,-0.57,-2.062%,5127971450.00,United States,2020,129883,Technology,Semiconductors
ALGN,Align Technology Inc. Common Stock,$547.1866,-6.6534,-1.201%,43300365647.00,United States,2001,133620,Health Care,Industrial Specialties
ALGS,Aligos Therapeutics Inc. Common Stock,$21.46,-1.20,-5.296%,818553673.00,United States,2020,24903,Health Care,Biotechnology: Biological Products (No Diagnostic Substances)
ALGT,Allegiant Travel Company Common Stock,$249.80,-2.13,-0.845%,4100706059.00,United States,2006,35250,Transportation,Air Freight/Delivery Services
ALHC,Alignment Healthcare Inc. Common Stock,$21.81,-1.78,-7.546%,4084441185.00,United States,2021,147475,Health Care,Medical Specialities
ALIM,Alimera Sciences Inc. Common Stock,$9.9451,0.0951,0.965%,57218476.00,United States,2010,5268,Health Care,Major Pharmaceuticals
ALJJ,ALJ Regional Holdings Inc. Common Stock,$1.63,0.02,1.242%,68983308.00,United States,,303585,Miscellaneous,Business Services
ALKS,Alkermes plc Ordinary Shares,$19.02,-0.09,-0.471%,3028704649.00,Ireland,1991,128111,Health Care,Major Pharmaceuticals
ALLK,Allakos Inc. Common Stock,$108.34,-1.66,-1.509%,5754740633.00,United States,2018,38547,Health Care,Major Pharmaceuticals
ALLO,Allogene Therapeutics Inc. Common Stock,$33.41,0.03,0.09%,4699043599.00,United States,2018,101602,Health Care,Biotechnology: Biological Products (No Diagnostic Substances)
ALLT,Allot Ltd. Ordinary Shares,$18.60,0.31,1.695%,662592376.00,Israel,2006,277433,Technology,Computer Communications Equipment
ALNA,Allena Pharmaceuticals Inc. Common Stock,$1.3215,0.0115,0.878%,75166496.00,United States,2017,347659,Health Care,Biotechnology: Biological Products (No Diagnostic Substances)
ALNY,Alnylam Pharmaceuticals Inc. Common Stock,$141.46,-0.55,-0.387%,16596105165.00,United States,2004,88268,Health Care,Major Pharmaceuticals
