Symbol,Name,Last Sale,Net Change,% Change,Market Cap,Country,IPO Year,Volume,Sector,Industry
REED,Reeds Inc. Common Stock,$1.195,0.025,2.137%,103251969.00,United States,,1180621,Consumer Non-Durables,Beverages (Production/Distribution)
REFR,Research Frontiers Incorporated Common Stock,$2.91,-0.12,-3.96%,92102652.00,United States,,26698,Miscellaneous,Multi-Sector Companies
REG,Regency Centers Corporation Common Stock,$57.01,-0.27,-0.471%,9681948725.00,United States,1993,179558,Consumer Services,Real Estate Investment Trusts
REGI,Renewable Energy Group Inc. Common Stock,$62.21,-3.10,-4.747%,2804727834.00,United States,2012,537332,Basic Industries,Major Chemicals
REGN,Regeneron Pharmaceuticals Inc. Common Stock,$480.50,1.82,0.38%,51476877470.00,United States,1991,218753,Health Care,Major Pharmaceuticals
REKR,Rekor Systems Inc. Common Stock,$21.28,-1.09,-4.873%,868313780.00,United States,,456505,Capital Goods,Telecommunications Equipment
RELI,Reliance Global Group Inc. Common Stock,$4.00,-0.10,-2.439%,16648460.00,United States,,99158,Finance,Specialty Insurers
RELIW,Reliance Global Group Inc. Series A Warrants,$0.75,-0.05,-6.25%,0.00,United States,,3750,Finance,Specialty Insurers
RELL,Richardson Electronics Ltd. Common Stock,$7.14,0.15,2.146%,94302650.00,United States,1983,348848,Technology,Electronic Components
REPH,Recro Pharma Inc. Common Stock,$3.14,-0.11,-3.385%,97381822.00,United States,2014,118754,Health Care,Major Pharmaceuticals
REPL,Replimune Group Inc. Common Stock,$30.40,-0.19,-0.621%,1413401397.00,United States,2018,102517,Health Care,Biotechnology: Biological Products (No Diagnostic Substances)
RESN,Resonant Inc. Common Stock,$4.00,-0.17,-4.077%,240478152.00,United States,2014,338296,Technology,Semiconductors
RETA,Reata Pharmaceuticals Inc. Class A Common Stock,$97.575,1.185,1.229%,3532305257.00,United States,2016,52697,Health Care,Major Pharmaceuticals
RETO,ReTo Eco-Solutions Inc. Common Shares,$1.44,-0.02,-1.37%,34754400.00,China,2017,65847,Capital Goods,Industrial Machinery/Components
REVHU,Revolution Healthcare Acquisition Corp. SAIL Units,$10.25,0.05,0.49%,0.00,United States,2021,13952,Finance,Business Services
REYN,Reynolds Consumer Products Inc. Common Stock,$29.98,-0.36,-1.187%,6286820990.00,United States,2020,128379,Consumer Durables,Containers/Packaging
RFIL,RF Industries Ltd. Common Stock,$6.49,-0.11,-1.667%,64721239.00,United States,,13069,Capital Goods,Electrical Products
RGCO,RGC Resources Inc. Common Stock,$22.495,-0.175,-0.772%,184806300.00,United States,,5622,Public Utilities,Oil & Gas Production
RGEN,Repligen Corporation Common Stock,$201.23,-3.74,-1.825%,11021637352.00,United States,1986,85317,Health Care,Biotechnology: Biological Products (No Diagnostic Substances)
RGLD,Royal Gold Inc. Common Stock,$110.285,-1.685,-1.505%,7235412411.00,United States,,87260,Basic Industries,Precious Metals
RGLS,Regulus Therapeutics Inc. Common Stock,$1.475,-0.005,-0.338%,106944539.00,United States,2012,187927,Health Care,Major Pharmaceuticals
RGNX,REGENXBIO Inc. Common Stock,$34.24,-0.29,-0.84%,1455148058.00,United States,2015,51349,Health Care,Biotechnology: Biological Products (No Diagnostic Substances)
RGP,Resources Connection Inc. Common Stock,$13.62,-0.16,-1.161%,442763114.00,United States,,97323,Miscellaneous,Business Services
RIBT,RiceBran Technologies Common Stock,$0.923,-0.037,-3.854%,41754754.00,United States,,76922,Consumer Non-Durables,Packaged Foods
RICK,RCI Hospitality Holdings Inc. Common Stock,$65.5232,-1.2868,-1.926%,589702903.00,United States,1995,28493,Consumer Services,Restaurants
RIDE,Lordstown Motors Corp. Class A Common Stock,$12.13,-0.065,-0.533%,2000830436.00,United States,2019,2736015,Capital Goods,Auto Manufacturing
RIGL,Rigel Pharmaceuticals Inc. Common Stock,$3.3297,-0.0103,-0.308%,566188341.00,United States,2000,717783,Health Care,Major Pharmaceuticals
RILY,B. Riley Financial Inc. Common Stock,$60.325,0.905,1.523%,1640302625.00,United States,,45903,Miscellaneous,Business Services
RILYG,B. Riley Financial Inc. 7.25% Senior Notes due 2027,$25.50,0.0102,0.04%,0.00,United States,,18039,Miscellaneous,Business Services
RILYH,B. Riley Financial Inc. 7.375% Senior Notes due 2023,$26.12,0.0889,0.342%,0.00,United States,,18770,Miscellaneous,Business Services
RILYI,B. Riley Financial Inc. 6.875% Senior Notes due 2023,$25.91,0.01,0.039%,0.00,United States,,3415,Miscellaneous,Business Services
RILYK,B. Riley Financial Inc. 5.50% Senior Notes Due 2026,$25.14,-0.01,-0.04%,0.00,United States,,16738,Miscellaneous,Business Services
RILYL,B. Riley Financial Inc. Depositary Shares each representing 1/1000th in a share of 7.375% Series B Cumulative Perpetual Preferred Stock par value $0.0001,$27.30,0.03,0.11%,0.00,United States,,7324,Miscellaneous,Business Services
RILYM,B. Riley Financial Inc. 6.375% Senior Notes due 2025,$25.835,0.035,0.136%,0.00,United States,,3101,Miscellaneous,Business Services
RILYN,B. Riley Financial Inc. 6.50% Senior Notes Due 2026,$25.95,-0.01,-0.039%,0.00,United States,,4501,Miscellaneous,Business Services
RILYO,B. Riley Financial Inc. 6.75% Senior Notes due 2024,$25.935,-0.216,-0.826%,0.00,United States,,4833,Miscellaneous,Business Services
RILYP,B. Riley Financial Inc. Depositary Shares each representing a 1/1000th fractional interest in a share of Series A Cumulative Perpetual Preferred Stock,$26.66,0.03,0.113%,0.00,United States,,4148,Miscellaneous,Business Services
RILYT,B. Riley Financial Inc. 6.00% Senior Notes Due 2028,$25.55,0.04,0.157%,0.00,United States,,19793,Miscellaneous,Business Services
RIOT,Riot Blockchain Inc.  Common Stock ,$48.8519,-5.2481,-9.701%,4109457148.00,United States,,8501902,Technology,EDP Services
RIVE,Riverview Financial Corporation Common Stock,$10.51,0.00,0.00%,98234027.00,United States,,203,Finance,Major Banks
RKDA,Arcadia Biosciences Inc. Common Stock,$2.6517,-0.0683,-2.511%,56554516.00,United States,2015,416979,Consumer Non-Durables,Farming/Seeds/Milling
RLAY,Relay Therapeutics Inc. Common Stock,$36.28,0.02,0.055%,3279710984.00,United States,2020,160113,Health Care,Biotechnology: Biological Products (No Diagnostic Substances)
RLMD,Relmada Therapeutics Inc. Common Stock,$37.27,-0.45,-1.193%,624171461.00,United States,,29837,Health Care,Major Pharmaceuticals
RMBI,Richmond Mutual Bancorporation Inc. Common Stock,$13.5301,0.1301,0.971%,176596435.00,United States,2019,7365,Finance,Major Banks
RMBL,RumbleOn Inc. Class B Common Stock,$42.09,-0.82,-1.911%,98339244.00,United States,,3590,Technology,EDP Services
RMBS,Rambus Inc. Common Stock,$20.32,-0.09,-0.441%,2285891410.00,United States,1997,108983,Technology,Semiconductors
RMCF,Rocky Mountain Chocolate Factory Inc. Common Stock,$5.67,0.05,0.89%,34441241.00,United States,,11270,Consumer Non-Durables,Specialty Foods
RMGB,RMG Acquisition Corp. II Class A Ordinary Shares,$9.9805,-0.1195,-1.183%,430409063.00,United States,2021,169849,Finance,Business Services
RMGBU,RMG Acquisition Corp. II Unit,$10.45,-0.08,-0.76%,0.00,United States,2020,32989,Finance,Business Services
RMGBW,RMG Acquisition Corp. II Warrant,$1.49,-0.09,-5.696%,0.00,United States,2021,18558,Finance,Business Services
RMGC,RMG Acquisition Corp. III Class A Ordinary Shares,$9.8899,0.0549,0.558%,597102713.00,United States,2021,226,Finance,Business Services
RMGCU,RMG Acquisition Corp. III Unit,$10.05,0.01,0.10%,0.00,United States,2021,84726,Finance,Business Services
RMGCW,RMG Acquisition Corp. III Warrant,$1.00,0.00,0.00%,0.00,United States,2021,8657,Finance,Business Services
RMNI,Rimini Street Inc. (DE) Common Stock,$8.93,-0.27,-2.935%,758651195.00,United States,2015,93689,Miscellaneous,Business Services
RMR,The RMR Group Inc. Class A Common Stock,$41.11,-0.15,-0.364%,674024802.00,United States,,4338,Consumer Services,Professional Services
RMRM,RMR Mortgage Trust Common Stock,$12.0228,-0.1772,-1.452%,122656714.00,United States,,6917,,
RMTI,Rockwell Medical Inc. (DE) Common Stock,$1.055,-0.005,-0.472%,98732998.00,United States,1998,245240,Health Care,Major Pharmaceuticals
RNA,Avidity Biosciences Inc. Common Stock,$23.61,-0.97,-3.946%,887372406.00,United States,2020,88259,Health Care,Major Pharmaceuticals
RNDB,Randolph Bancorp Inc. Common Stock,$19.55,-0.225,-1.138%,105858128.00,United States,2016,1294,Finance,Major Banks
RNET,RigNet Inc. Common Stock,$9.04,-0.13,-1.418%,189984667.00,United States,2010,15529,Consumer Services,Telecommunications Equipment
RNLX,Renalytix AI plc American Depositary Shares,$24.522,0.192,0.789%,883371774.00,United Kingdom,2020,4835,Health Care,Medical Specialities
RNST,Renasant Corporation Common Stock,$41.57,-0.38,-0.906%,2337851281.00,United States,,40134,Finance,Major Banks
RNWK,RealNetworks Inc. Common Stock,$4.87,-0.04,-0.815%,187620597.00,United States,1997,426984,Technology,EDP Services
ROAD,Construction Partners Inc. Class A Common Stock,$30.05,0.20,0.67%,1556341937.00,United States,2018,88607,Basic Industries,Military/Government/Technical
ROCC,Roth CH Acquisition II Co. Common Stock,$10.06,-0.06,-0.593%,147379000.00,United States,2021,14486,Finance,Business Services
ROCCU,Roth CH Acquisition II Co. Unit,$10.70,0.12,1.134%,0.00,United States,2020,3092,Finance,Business Services
ROCCW,Roth CH Acquisition II Co. Warrant,$1.36,-0.18,-11.688%,0.00,United States,2021,11406,Finance,Business Services
ROCK,Gibraltar Industries Inc. Common Stock,$87.00,-2.78,-3.096%,2838743184.00,United States,1993,43867,Capital Goods,Steel/Iron Ore
ROCR,Roth CH Acquisition III Co. Common stock,$9.94,0.00,0.00%,146943020.00,United States,2021,100,Finance,Business Services
ROCRU,Roth CH Acquisition III Co. Unit,$9.87,-0.08,-0.804%,0.00,United States,2021,30410,Finance,Business Services
ROCRW,Roth CH Acquisition III Co. Warrant,$0.7754,0.00,0.00%,0.00,United States,2021,1,Finance,Business Services
ROIC,Retail Opportunity Investments Corp. Common Stock (MD),$16.195,-0.25,-1.52%,1919366248.00,United States,,146882,Consumer Services,Real Estate Investment Trusts
ROKU,Roku Inc. Class A Common Stock,$360.797,1.427,0.397%,46334252490.00,United States,2017,3571912,Consumer Services,Television Services
ROLL,RBC Bearings Incorporated Common Stock,$196.735,-1.605,-0.809%,4945846092.00,United States,2005,13172,Capital Goods,Metal Fabrications
ROOT,Root Inc. Class A Common Stock,$12.19,-0.11,-0.894%,3068163732.00,United States,2020,640578,Finance,Property-Casualty Insurers
ROST,Ross Stores Inc. Common Stock,$123.17,-0.33,-0.267%,43912980896.00,United States,1985,445876,Consumer Services,Clothing/Shoe/Accessory Stores
RP,RealPage Inc. Common Stock,$87.81,0.20,0.228%,8964656898.00,United States,2010,226415,Technology,Computer Software: Prepackaged Software
RPAY,Repay Holdings Corporation Class A Common Stock,$24.035,0.065,0.271%,1935457792.00,United States,2018,111001,Miscellaneous,Business Services
RPD,Rapid7 Inc. Common Stock,$77.88,-0.28,-0.358%,4103300319.00,United States,2015,61690,Technology,Computer Software: Prepackaged Software
RPRX,Royalty Pharma plc Class A Ordinary Shares ,$41.765,-0.745,-1.753%,25355985486.00,United States,2020,277241,Health Care,Major Pharmaceuticals
RPTX,Repare Therapeutics Inc. Common Shares,$31.00,0.28,0.911%,1146485400.00,Canada,2020,36219,Health Care,Major Pharmaceuticals
RRBI,Red River Bancshares Inc. Common Stock,$56.00,-0.50,-0.885%,409278072.00,United States,2019,1951,Finance,Major Banks
RRGB,Red Robin Gourmet Burgers Inc. Common Stock,$38.11,0.88,2.364%,593549797.00,United States,2002,141496,Consumer Services,Restaurants
RRR,Red Rock Resorts Inc. Class A Common Stock,$34.60,0.45,1.318%,4059063431.00,United States,2016,254538,Consumer Services,Hotels/Resorts
RSSS,Research Solutions Inc Common Stock,$2.3889,0.0589,2.528%,62774747.00,United States,,52778,Miscellaneous,Business Services
RSVA,Rodgers Silicon Valley Acquisition Corp. Common Stock,$14.23,0.26,1.861%,409112500.00,United States,2021,48391,Finance,Business Services
RSVAU,Rodgers Silicon Valley Acquisition Corp. Unit,$16.375,-0.04,-0.244%,0.00,United States,2020,3268,Finance,Business Services
RSVAW,Rodgers Silicon Valley Acquisition Corp. Warrant,$4.87,-0.005,-0.103%,0.00,United States,2021,574,Finance,Business Services
RTLR,Rattler Midstream LP Common Units,$11.0205,0.0405,0.369%,1646762226.00,United States,2019,60803,Public Utilities,Natural Gas Distribution
RTPYU,Reinvent Technology Partners Y Unit,$10.04,-0.04,-0.397%,0.00,United States,2021,113377,Finance,Business Services
RUBY,Rubius Therapeutics Inc. Common Stock,$23.95,-0.56,-2.285%,2109480650.00,United States,2018,247577,Health Care,Biotechnology: Biological Products (No Diagnostic Substances)
RUHN,Ruhnn Holding Limited American Depositary Shares,$3.39,-0.01,-0.294%,280200531.00,China,2019,51126,Consumer Services,Catalog/Specialty Distribution
RUN,Sunrun Inc. Common Stock,$54.77,-1.45,-2.579%,11095507770.00,United States,2015,2204945,Capital Goods,Industrial Specialties
RUSHA,Rush Enterprises Inc. Common Stock Cl A,$49.345,-1.025,-2.035%,2717659048.00,United States,,21518,Consumer Durables,Automotive Aftermarket
RUSHB,Rush Enterprises Inc. Class B,$44.57,-1.00,-2.194%,2454677552.00,United States,,4042,Consumer Durables,Automotive Aftermarket
RUTH,Ruth's Hospitality Group Inc. Common Stock,$24.52,0.15,0.616%,857256397.00,United States,2005,114969,Consumer Services,Restaurants
RVMD,Revolution Medicines Inc. Common Stock,$46.02,-1.42,-2.993%,3377095140.00,United States,2020,58441,Health Care,Biotechnology: Biological Products (No Diagnostic Substances)
RVNC,Revance Therapeutics Inc. Common Stock,$27.525,-0.175,-0.632%,1964814157.00,United States,2014,32426,Health Care,Major Pharmaceuticals
RVPH,Reviva Pharmaceuticals Holdings Inc. Common Stock ,$5.29,0.05,0.954%,27161785.00,United States,2020,2113,Health Care,Major Pharmaceuticals
RVPHW,Reviva Pharmaceuticals Holdings Inc. Warrants,$0.4333,-0.0393,-8.316%,0.00,United States,2018,46468,Health Care,Major Pharmaceuticals
RVSB,Riverview Bancorp Inc Common Stock,$6.90,-0.14,-1.989%,154182122.00,United States,,12049,Finance,Savings Institutions
RWLK,ReWalk Robotics Ltd. Ordinary Shares,$2.255,-0.015,-0.661%,100047486.00,Israel,2014,270968,Health Care,Industrial Specialties
RXDX,Prometheus Biosciences Inc. Common Stock,$18.83,-0.02,-0.106%,729743092.00,United States,2021,29827,Health Care,Major Pharmaceuticals
RXRAU,RXR Acquisition Corp. Units,$9.95,-0.03,-0.301%,0.00,United States,2021,31700,Finance,Business Services
RXT,Rackspace Technology Inc. Common Stock,$25.35,-0.13,-0.51%,5210005946.00,United States,2020,186526,Technology,Computer Software: Programming Data Processing
RYAAY,Ryanair Holdings plc American Depositary Shares,$112.11,-2.01,-1.761%,25293406725.00,Ireland,1997,103275,Transportation,Air Freight/Delivery Services
RYTM,Rhythm Pharmaceuticals Inc. Common Stock,$22.02,1.15,5.51%,1104989231.00,United States,2017,130019,Health Care,Major Pharmaceuticals
RZLT,Rezolute Inc. Common Stock,$7.13,0.00,0.00%,59551735.00,United States,,2377,Health Care,Major Pharmaceuticals
SABR,Sabre Corporation Common Stock,$15.345,-0.335,-2.136%,4869506695.00,United States,2014,1476117,Technology,Computer Software: Programming Data Processing
SABRP,Sabre Corporation 6.50% Series A Mandatory Convertible Preferred Stock,$193.73,-3.16,-1.605%,,United States,,597,Technology,Computer Software: Programming Data Processing
SAFM,Sanderson Farms Inc. Common Stock,$163.02,-0.82,-0.50%,3640300830.00,United States,1987,20103,Consumer Non-Durables,Meat/Poultry/Fish
SAFT,Safety Insurance Group Inc. Common Stock,$85.39,-0.68,-0.79%,1271772872.00,United States,2002,36013,Finance,Property-Casualty Insurers
SAGE,Sage Therapeutics Inc. Common Stock,$79.278,-0.012,-0.015%,4628402884.00,United States,2014,219523,Health Care,Major Pharmaceuticals
SAIA,Saia Inc. Common Stock,$232.00,3.33,1.456%,6108487848.00,United States,,57488,Transportation,Trucking Freight/Courier Services
SAII,Software Acquisition Group Inc. II Class A Common Stock,$10.16,-0.10,-0.975%,219075000.00,United States,2020,55344,Finance,Business Services
SAIIU,Software Acquisition Group Inc. II Unit,$10.96,-0.35,-3.095%,0.00,United States,2020,5950,Finance,Business Services
SAIIW,Software Acquisition Group Inc. II Warrant,$1.929,-0.101,-4.975%,0.00,United States,2020,10637,Finance,Business Services
SAL,Salisbury Bancorp Inc. Common Stock,$44.30,0.17,0.385%,126040012.00,United States,,975,Finance,Savings Institutions
SALM,Salem Media Group Inc. Class A Common Stock,$2.86,-0.04,-1.379%,76777375.00,United States,1999,44794,Consumer Services,Broadcasting
SAMG,Silvercrest Asset Management Group Inc. Class A Common Stock,$14.35,-0.12,-0.829%,207069524.00,United States,2013,3258,Finance,Investment Managers
SANA,Sana Biotechnology Inc. Common Stock,$31.75,-0.25,-0.781%,5953310960.00,United States,2021,91657,Health Care,Biotechnology: Biological Products (No Diagnostic Substances)
SANM,Sanmina Corporation Common Stock,$41.32,-0.79,-1.876%,2682765831.00,United States,1993,62897,Technology,Electrical Products
SANW,S&W Seed Company Common Stock (NV),$3.82,0.03,0.792%,134003098.00,United States,,5948,Consumer Non-Durables,Farming/Seeds/Milling
SASR,Sandy Spring Bancorp Inc. Common Stock,$42.865,-0.405,-0.936%,2032799326.00,United States,,78387,Finance,Major Banks
SATS,EchoStar  Corporation Common Stock,$23.69,-0.55,-2.269%,2201877000.00,United States,,191107,Consumer Services,Telecommunications Equipment
SAVA,Cassava Sciences Inc. Common Stock,$41.61,-1.21,-2.826%,1660169303.00,United States,,455996,Health Care,Major Pharmaceuticals
SBAC,SBA Communications Corporation Class A Common Stock,$283.89,-1.57,-0.55%,31014459291.00,United States,1999,73292,Consumer Services,Real Estate Investment Trusts
SBBP,Strongbridge Biopharma plc Ordinary Shares,$2.71,-0.01,-0.368%,183047950.00,United States,2015,186414,Health Care,Major Pharmaceuticals
SBCF,Seacoast Banking Corporation of Florida Common Stock,$36.11,-0.36,-0.987%,1995072806.00,United States,,37206,Finance,Major Banks
SBEAU,SilverBox Engaged Merger Corp I Units,$9.99,0.00,0.00%,0.00,United States,2021,619,Finance,Business Services
SBFG,SB Financial Group Inc. Common Stock,$17.69,-0.53,-2.909%,130722484.00,United States,,11394,Finance,Major Banks
SBGI,Sinclair Broadcast Group Inc. Class A Common Stock,$29.88,-0.04,-0.134%,2212876496.00,United States,1995,357296,Consumer Services,Broadcasting
SBLK,Star Bulk Carriers Corp. Common Shares,$14.48,0.12,0.836%,1436991088.00,Greece,,278153,Transportation,Marine Transportation
SBLKZ,Star Bulk Carriers Corp. 8.30% Senior Notes due 2022,$25.8242,0.00,0.00%,0.00,Greece,,1,Transportation,Marine Transportation
SBNY,Signature Bank Common Stock,$225.0078,1.3978,0.625%,12966054449.00,United States,2004,84966,Finance,Major Banks
SBNYP,Signature Bank Depositary shares each representing a 1/40th ownership interest in a share of 5.000% Noncumulative Perpetual Series A Preferred Stock,$25.775,0.085,0.331%,0.00,United States,,17795,Finance,Major Banks
SBRA,Sabra Health Care REIT Inc. Common Stock,$18.16,-0.185,-1.008%,3826672367.00,United States,,296587,Consumer Services,Real Estate Investment Trusts
SBSI,Southside Bancshares Inc. Common Stock,$38.41,-0.14,-0.363%,1260612858.00,United States,,31142,Finance,Major Banks
SBT,Sterling Bancorp Inc. Common Stock,$5.43,-0.19,-3.381%,271524381.00,United States,2017,3659,Finance,Savings Institutions
SBTX,Silverback Therapeutics Inc. Common Stock,$39.4495,-0.3505,-0.881%,1376925505.00,United States,2020,21508,Health Care,Major Pharmaceuticals
SBUX,Starbucks Corporation Common Stock,$112.8301,-0.3199,-0.283%,132834876730.00,United States,1992,1651816,Consumer Services,Restaurants
SCAQU,Stratim Cloud Acquisition Corp. Unit,$9.9817,-0.0183,-0.183%,0.00,United States,2021,1000,Finance,Business Services
SCHL,Scholastic Corporation Common Stock,$30.67,-0.62,-1.981%,1052843778.00,United States,1992,36218,Consumer Services,Books
SCHN,Schnitzer Steel Industries Inc. Class A Common Stock,$42.10,0.56,1.348%,1155801107.00,United States,1993,205804,Consumer Durables,Industrial Specialties
SCKT,Socket Mobile Inc. Common Stock,$8.005,-0.275,-3.321%,55565779.00,United States,,100825,Technology,Computer Manufacturing
SCLE,Broadscale Acquisition Corp. Class A common stock,$9.8573,-0.5372,-5.168%,0.00,United States,2021,2042,Finance,Business Services
SCLEU,Broadscale Acquisition Corp. Units,$9.9501,-0.01,-0.10%,0.00,United States,2021,12126,Finance,Business Services
SCOA,ScION Tech Growth I Class A Ordinary Shares,$9.98,0.00,0.00%,0.00,United Kingdom,2021,1104,Finance,Business Services
SCOAU,ScION Tech Growth I Unit,$10.207,-0.083,-0.807%,0.00,United Kingdom,2020,2612,Finance,Business Services
SCOAW,ScION Tech Growth I Warrant,$0.93,-0.02,-2.105%,0.00,United Kingdom,2021,6216,Finance,Business Services
SCOB,ScION Tech Growth II Class A Ordinary Shares,$9.90,0.00,0.00%,426937500.00,United Kingdom,2021,363,Finance,Business Services
SCOBU,ScION Tech Growth II Units,$10.00,-0.04,-0.398%,0.00,United Kingdom,2021,200,Finance,Business Services
SCOR,comScore Inc. Common Stock,$3.55,-0.05,-1.389%,285067020.00,United States,2018,165977,Miscellaneous,Business Services
SCPH,scPharmaceuticals Inc. Common Stock,$6.53,-0.05,-0.76%,178399332.00,United States,2017,9927,Health Care,Major Pharmaceuticals
SCPL,SciPlay Corporation Class A Common Stock,$17.25,-0.01,-0.058%,394364204.00,United States,2019,63817,Technology,EDP Services
SCPS,Scopus BioPharma Inc. Common Stock,$8.55,0.05,0.588%,134470954.00,United States,2020,6206,Health Care,Major Pharmaceuticals
SCR,Score Media and Gaming Inc. Class A Subordinate Voting Shares,$23.485,-1.695,-6.732%,1182308291.00,Canada,,421433,Consumer Services,Services-Misc. Amusement & Recreation
SCSC,ScanSource Inc. Common Stock,$30.32,-0.47,-1.526%,771697545.00,United States,,4998,Technology,Retail: Computer Software & Peripheral Equipment
SCVL,Shoe Carnival Inc. Common Stock,$61.48,0.64,1.052%,867209275.00,United States,1993,25507,Consumer Services,Clothing/Shoe/Accessory Stores
SCWX,SecureWorks Corp. Class A Common Stock,$13.87,-0.30,-2.117%,1151615822.00,United States,2016,10417,Technology,Computer Software: Prepackaged Software
SCYX,SCYNEXIS Inc. Common Stock,$8.45,0.02,0.237%,174262474.00,United States,2014,79397,Health Care,Major Pharmaceuticals
SDAC,Sustainable Development Acquisition I Corp. Class A Common Stock,$9.75,-0.0878,-0.892%,385429688.00,United States,2021,150134,Finance,Business Services
SDACU,Sustainable Development Acquisition I Corp. Unit,$10.12,0.07,0.697%,0.00,United States,2021,805,Finance,Business Services
SDACW,Sustainable Development Acquisition I Corp. Warrant,$0.6999,-0.07,-9.092%,0.00,United States,2021,15196,Finance,Business Services
SDC,SmileDirectClub Inc. Class A Common Stock,$10.035,-0.205,-2.002%,3882964305.00,United States,2019,675769,Health Care,Medical/Dental Instruments
SDGR,Schrodinger Inc. Common Stock,$75.0692,-3.5008,-4.456%,5255766300.00,United States,2020,371247,Health Care,Major Pharmaceuticals
SDH,Global Internet of People Inc. Ordinary Shares,$3.61,0.09,2.557%,84907200.00,China,2021,93931,Miscellaneous,Business Services
SEAC,SeaChange International Inc. Common Stock,$1.435,-0.065,-4.333%,54267969.00,United States,1996,4409599,Technology,Radio And Television Broadcasting And Communications Equipment
SECO,Secoo Holding Limited ADR,$2.50,0.00,0.00%,176631405.00,China,2017,90315,Consumer Services,Other Specialty Stores
SEDG,SolarEdge Technologies Inc. Common Stock,$262.76,-14.49,-5.226%,13553570443.00,Israel,2015,261667,Technology,Semiconductors
SEED,Origin Agritech Limited Common Stock,$16.98,-0.12,-0.702%,96549520.00,China,,38777,Consumer Non-Durables,Farming/Seeds/Milling
SEEL,Seelos Therapeutics Inc. Common Stock,$5.31,0.36,7.273%,388955132.00,United States,,3878298,Health Care,Major Pharmaceuticals
SEER,Seer Inc. Class A Common Stock,$52.71,-2.24,-4.076%,3210621498.00,United States,2020,136487,Capital Goods,Biotechnology: Laboratory Analytical Instruments
SEIC,SEI Investments Company Common Stock,$62.46,0.11,0.176%,8964051208.00,United States,1981,60882,Finance,Investment Bankers/Brokers/Service
SELB,Selecta Biosciences Inc. Common Stock,$4.16,-0.16,-3.704%,467472508.00,United States,2016,308675,Health Care,Major Pharmaceuticals
SELF,Global Self Storage Inc. Common Stock,$4.91,-0.14,-2.772%,45938952.00,United States,,15286,Consumer Services,Real Estate Investment Trusts
SENEA,Seneca Foods Corp. Class A Common Stock,$50.35,0.42,0.841%,456583266.00,United States,,16815,Consumer Non-Durables,Packaged Foods
SENEB,Seneca Foods Corp. Class B Common Stock,$50.21,0.89,1.805%,455313719.00,United States,,401,Consumer Non-Durables,Packaged Foods
SESN,Sesen Bio Inc. Common Stock,$2.65,-0.06,-2.214%,448873499.00,United States,2014,1868960,Health Care,Major Pharmaceuticals
SFBC,Sound Financial Bancorp Inc. Common Stock,$41.50,0.00,0.00%,107939591.00,United States,,12,Finance,Savings Institutions
SFBS,ServisFirst Bancshares Inc. Common Stock,$61.02,-0.69,-1.118%,3301121224.00,United States,2014,31193,Finance,Major Banks
SFET,Safe-T Group Ltd. American Depositary Share,$1.3988,-0.0712,-4.844%,36536487.00,Israel,2018,221801,Technology,Computer Software: Prepackaged Software
SFIX,Stitch Fix Inc. Class A Common Stock,$51.215,-0.365,-0.708%,5446491236.00,United States,2017,578558,Consumer Services,Catalog/Specialty Distribution
SFM,Sprouts Farmers Market Inc. Common Stock,$26.65,0.16,0.604%,3143459043.00,United States,2013,546974,Consumer Services,Food Chains
SFNC,Simmons First National Corporation Class A Common Stock,$29.16,-0.75,-2.508%,3151820128.00,United States,,152896,Finance,Major Banks
SFST,Southern First Bancshares Inc. Common Stock,$47.875,-0.705,-1.451%,373286067.00,United States,,5798,Finance,Major Banks
SFT,Shift Technologies Inc. Class A Common Stock,$8.41,-0.04,-0.473%,707182914.00,United States,2019,215193,Consumer Durables,Automotive Aftermarket
SGA,Saga Communications Inc. Class A Common Stock (FL),$21.5399,-0.2601,-1.193%,128817067.00,United States,,1888,Consumer Services,Broadcasting
