Symbol,Name,Last Sale,Net Change,% Change,Market Cap,Country,IPO Year,Volume,Sector,Industry
CTAQW,Carney Technology Acquisition Corp. II Warrant,$0.90,0.00,0.00%,0.00,United States,2021,12473,Finance,Business Services
CTAS,Cintas Corporation Common Stock,$347.56,-1.31,-0.375%,36507415315.00,United States,1983,68746,Consumer Non-Durables,Apparel
CTBI,Community Trust Bancorp Inc. Common Stock,$44.125,-0.425,-0.954%,786575604.00,United States,,6520,Finance,Major Banks
CTG,Computer Task Group Inc. Common Stock,$10.53,0.33,3.235%,159980658.00,United States,,86768,Technology,EDP Services
CTHR,Charles & Colvard Ltd Common Stock,$3.16,0.18,6.04%,92280801.00,United States,1997,570482,Consumer Durables,Consumer Specialties
CTIB,Yunhong CTI Ltd. Common Stock,$2.16,-0.04,-1.818%,12492675.00,United States,1997,41718,Basic Industries,Specialty Chemicals
CTIC,CTI BioPharma Corp. (DE) Common Stock,$2.63,0.01,0.382%,201687683.00,United States,1997,617474,Health Care,Major Pharmaceuticals
CTMX,CytomX Therapeutics Inc. Common Stock,$7.78,-0.41,-5.006%,504022282.00,United States,2015,163624,Health Care,Major Pharmaceuticals
CTRE,CareTrust REIT Inc. Common Stock,$24.175,-0.21,-0.861%,2321400265.00,United States,,80321,Consumer Services,Real Estate Investment Trusts
CTRM,Castor Maritime Inc. Common Shares,$0.5075,-0.0613,-10.777%,358929777.00,Cyprus,,115005076,Transportation,Marine Transportation
CTRN,Citi Trends Inc. Common Stock,$87.79,-1.48,-1.658%,890099474.00,United States,2005,94889,Consumer Services,Clothing/Shoe/Accessory Stores
CTSH,Cognizant Technology Solutions Corporation Class A Common Stock,$79.53,-0.13,-0.163%,42199751939.00,United States,1998,483629,Technology,EDP Services
CTSO,Cytosorbents Corporation Common Stock,$8.83,-0.07,-0.787%,381084072.00,United States,,40069,Health Care,Medical/Dental Instruments
CTXR,Citius Pharmaceuticals Inc. Common Stock,$1.79,-0.04,-2.186%,241115182.00,United States,,1311809,Health Care,Major Pharmaceuticals
CTXRW,Citius Pharmaceuticals Inc. Warrant,$0.6701,-0.2799,-29.463%,0.00,United States,,1119,Health Care,Major Pharmaceuticals
CTXS,Citrix Systems Inc. Common Stock,$143.165,1.185,0.835%,17604101976.00,United States,1995,387348,Technology,Computer Software: Prepackaged Software
CUBA,Herzfeld Caribbean Basin Fund Inc. (The) Common Stock,$6.1223,0.0173,0.283%,37552137.00,United States,,5752,,
CUE,Cue Biopharma Inc. Common Stock,$12.285,-0.185,-1.484%,374167316.00,United States,2018,31248,Health Care,Major Pharmaceuticals
CUEN,Cuentas Inc. Common Stock,$3.5127,-0.1273,-3.497%,48544112.00,United States,,46533,Consumer Non-Durables,Food Distributors
CUENW,Cuentas Inc. Warrant,$0.7999,-0.0801,-9.102%,0.00,United States,,900,Consumer Non-Durables,Food Distributors
CURI,CuriosityStream Inc. Class A Common Stock,$13.29,-0.21,-1.556%,698362920.00,United States,2020,262458,Consumer Services,Movies/Entertainment
CURIW,CuriosityStream Inc. Warrant,$5.10,0.0241,0.475%,0.00,United States,2020,15841,Consumer Services,Movies/Entertainment
CUTR,Cutera Inc. Common Stock,$30.59,-0.61,-1.955%,543978054.00,United States,2004,49056,Health Care,Biotechnology: Electromedical & Electrotherapeutic Apparatus
CVAC,CureVac N.V. Ordinary Shares,$89.72,-2.82,-3.047%,16769877426.00,Germany,2020,247067,Health Care,Major Pharmaceuticals
CVBF,CVB Financial Corporation Common Stock,$21.83,-0.24,-1.087%,2960158937.00,United States,,62105,Finance,Major Banks
CVCO,Cavco Industries Inc. Common Stock When Issued,$236.32,-4.04,-1.681%,2172309448.00,United States,,5723,Basic Industries,Homebuilding
CVCY,Central Valley Community Bancorp Common Stock,$18.955,-0.405,-2.092%,237403964.00,United States,,10279,Finance,Major Banks
CVET,Covetrus Inc. Common Stock,$29.37,0.00,0.00%,4002314837.00,United States,,103104,Health Care,Medical/Nursing Services
CVGI,Commercial Vehicle Group Inc. Common Stock,$9.63,-0.13,-1.332%,313100845.00,United States,2004,45747,Capital Goods,Auto Parts:O.E.M.
CVGW,Calavo Growers Inc. Common Stock,$77.98,-0.68,-0.864%,1380246000.00,United States,,9852,Consumer Non-Durables,Farming/Seeds/Milling
CVLG,Covenant Logistics Group Inc. Class A Common Stock,$20.665,-0.575,-2.707%,347172041.00,United States,,27274,Transportation,Trucking Freight/Courier Services
CVLT,Commvault Systems Inc. Common Stock,$66.20,-0.98,-1.459%,3111242179.00,United States,2006,57359,Technology,Computer Software: Prepackaged Software
CVLY,Codorus Valley Bancorp Inc Common Stock,$17.69,-0.66,-3.597%,174069441.00,United States,,9703,Finance,Savings Institutions
CVV,CVD Equipment Corporation Common Stock,$4.29,0.02,0.468%,28664840.00,United States,,2589,Technology,Industrial Machinery/Components
CWBC,Community West Bancshares Common Stock,$13.25,0.00,0.00%,112665585.00,United States,,14,Finance,Major Banks
CWBR,CohBar Inc. Common Stock,$1.2701,-0.0499,-3.78%,78477352.00,United States,,100059,Health Care,Major Pharmaceuticals
CWCO,Consolidated Water Co. Ltd. Ordinary Shares,$12.925,-0.135,-1.034%,196068204.00,Cayman Islands,,30432,Public Utilities,Water Supply
CWST,Casella Waste Systems Inc. Class A Common Stock,$65.335,-0.035,-0.054%,3337935815.00,United States,1997,35419,Public Utilities,Environmental Services
CXDC,China XD Plastics Company Limited Common Stock,$1.08,-0.02,-1.818%,76192748.00,China,,15968,Capital Goods,Containers/Packaging
CXDO,Crexendo Inc. Common Stock,$6.27,0.05,0.804%,115346663.00,United States,,2684,Public Utilities,Telecommunications Equipment
CYAD,Celyad Oncology SA American Depositary Shares,$7.19,0.23,3.305%,102135072.00,Belgium,2015,31748,Health Care,Major Pharmaceuticals
CYAN,Cyanotech Corporation Common Stock,$3.262,-0.088,-2.627%,19888652.00,United States,,51546,Consumer Durables,Specialty Chemicals
CYBE,CyberOptics Corporation Common Stock,$27.341,-0.119,-0.433%,199572239.00,United States,1987,15660,Capital Goods,Electronic Components
CYBR,CyberArk Software Ltd. Ordinary Shares,$136.91,1.35,0.996%,5351606809.00,Israel,2014,148754,Technology,Computer Software: Prepackaged Software
CYCC,Cyclacel Pharmaceuticals Inc. Common Stock,$7.14,-0.04,-0.557%,65558509.00,United States,,41523,Health Care,Major Pharmaceuticals
CYCCP,Cyclacel Pharmaceuticals Inc. 6% Convertible Preferred Stock,$8.38,0.00,0.00%,0.00,United States,,30,Health Care,Major Pharmaceuticals
CYCN,Cyclerion Therapeutics Inc. Common Stock,$2.85,-0.03,-1.042%,97055906.00,United States,,69563,Health Care,Major Pharmaceuticals
CYRN,CYREN Ltd. Ordinary Shares,$0.8244,-0.0126,-1.505%,61780976.00,United States,,206562,Technology,Computer Software: Prepackaged Software
CYRX,CryoPort Inc. Common Stock,$51.07,-0.32,-0.623%,2329027841.00,United States,,135425,Health Care,Major Pharmaceuticals
CYTH,Cyclo Therapeutics Inc. Common Stock,$7.93,-0.30,-3.645%,49903078.00,United States,,106545,Basic Industries,Major Chemicals
CYTHW,Cyclo Therapeutics Inc. Warrant,$3.15,-0.50,-13.699%,0.00,United States,,347,Basic Industries,Major Chemicals
CYTK,Cytokinetics Incorporated Common Stock,$24.00,-0.15,-0.621%,1706653824.00,United States,2004,180149,Health Care,Major Pharmaceuticals
CZNC,Citizens & Northern Corp Common Stock,$23.8399,-0.3401,-1.407%,381461000.00,United States,,17415,Finance,Major Banks
CZR,Caesars Entertainment Inc. Common Stock,$92.18,-0.32,-0.346%,19199013866.00,United States,,724453,Consumer Services,Hotels/Resorts
CZWI,Citizens Community Bancorp Inc. Common Stock,$13.2022,0.1922,1.477%,143908495.00,United States,,31751,Finance,Savings Institutions
DADA,Dada Nexus Limited American Depositary Shares,$26.145,-0.425,-1.60%,6163095984.00,China,2020,282443,Technology,Computer Software: Programming Data Processing
DAIO,Data I/O Corporation Common Stock,$5.5789,-0.0611,-1.083%,46983259.00,United States,1981,1551,Capital Goods,Electrical Products
DAKT,Daktronics Inc. Common Stock,$6.41,-0.15,-2.287%,288234502.00,United States,1994,88933,Consumer Durables,Miscellaneous manufacturing industries
DARE,Dare Bioscience Inc. Common Stock,$1.69,-0.02,-1.17%,79958669.00,United States,2014,296386,Health Care,Major Pharmaceuticals
DBDR,Roman DBDR Tech Acquisition Corp. Class A Common Stock,$9.92,0.00,0.00%,287134400.00,United States,2020,2539,Finance,Business Services
DBDRU,Roman DBDR Tech Acquisition Corp. Unit,$10.24,-0.13,-1.254%,0.00,United States,2020,11100,Finance,Business Services
DBDRW,Roman DBDR Tech Acquisition Corp. Warrant,$0.725,-0.015,-2.027%,0.00,United States,2020,10900,Finance,Business Services
DBTX,Decibel Therapeutics Inc. Common Stock,$10.89,-0.62,-5.387%,271178174.00,United States,2021,17806,Health Care,Major Pharmaceuticals
DBVT,DBV Technologies S.A. American Depositary Shares,$5.58,0.11,2.011%,613093427.00,France,2014,76128,Health Care,Biotechnology: Biological Products (No Diagnostic Substances)
DBX,Dropbox Inc. Class A Common Stock,$27.71,-0.10,-0.36%,11491806768.00,United States,2018,1537348,Technology,Computer Software: Prepackaged Software
DCBO,Docebo Inc. Common Shares,$45.3135,-0.7065,-1.535%,1481271943.00,Canada,,14236,Technology,Computer Software: Prepackaged Software
DCOM,Dime Community Bancshares Inc. Common Stock,$31.23,-0.63,-1.977%,1295678828.00,United States,,41980,Finance,Savings Institutions
DCOMP,Dime Community Bancshares Inc. Fixed-Rate Non-Cumulative Perpetual Preferred Stock Series A,$25.3799,0.0599,0.237%,0.00,United States,,2115,Finance,Major Banks
DCPH,Deciphera Pharmaceuticals Inc. Common Stock,$44.49,0.00,0.00%,2563778204.00,United States,2017,49192,Health Care,Major Pharmaceuticals
DCRB,Decarbonization Plus Acquisition Corporation Class A Common Stock,$10.3601,-0.0499,-0.479%,292316717.00,United States,2020,122407,Energy,Industrial Machinery/Components
DCRBU,Decarbonization Plus Acquisition Corporation Unit,$11.50,-0.01,-0.087%,0.00,United States,2020,7510,Energy,Industrial Machinery/Components
DCRBW,Decarbonization Plus Acquisition Corporation Warrant,$2.11,0.00,0.00%,0.00,United States,2020,31272,Energy,Industrial Machinery/Components
DCRCU,Decarbonization Plus Acquisition Corporation III Unit,$10.01,0.01,0.10%,0.00,United States,2021,3462,Finance,Business Services
DCRN,Decarbonization Plus Acquisition Corporation II Class A Common stock,$9.815,-0.0015,-0.015%,493817188.00,United States,2021,18331,Finance,Business Services
DCRNU,Decarbonization Plus Acquisition Corporation II Unit,$10.1899,0.0899,0.89%,0.00,United States,2021,115367,Finance,Business Services
DCRNW,Decarbonization Plus Acquisition Corporation II Warrant,$1.35,0.23,20.536%,0.00,United States,2021,65092,Finance,Business Services
DCT,Duck Creek Technologies Inc. Common Stock,$42.29,-1.29,-2.96%,5541033379.00,United States,2020,162584,Technology,Computer Software: Prepackaged Software
DCTH,Delcath Systems Inc. Common Stock,$14.05,0.15,1.079%,87830161.00,United States,,51031,Health Care,Medical/Dental Instruments
DDMX,DD3 Acquisition Corp. II Class A Common Stock,$9.89,0.00,0.00%,71437448.00,Mexico,2021,3,Finance,Business Services
DDMXU,DD3 Acquisition Corp. II Unit,$10.31,-0.05,-0.483%,0.00,Mexico,2020,101,Finance,Business Services
DDMXW,DD3 Acquisition Corp. II Warrant,$1.02,-0.08,-7.273%,0.00,Mexico,2021,488,Finance,Business Services
DDOG,Datadog Inc. Class A Common Stock,$86.90,-1.99,-2.239%,26634135248.00,United States,2019,791682,Technology,Computer Software: Prepackaged Software
DENN,Denny's Corporation Common Stock,$17.95,-0.12,-0.664%,1151399968.00,United States,,366661,Consumer Services,Restaurants
DFFN,Diffusion Pharmaceuticals Inc. Common Stock,$0.8669,-0.0131,-1.489%,88340559.00,United States,,668317,Health Care,Major Pharmaceuticals
DFH,Dream Finders Homes Inc. Class A Common Stock,$24.20,-0.40,-1.626%,2239019864.00,United States,2021,29716,Capital Goods,Homebuilding
DFHT,Deerfield Healthcare Technology Acquisitions Corp. Class A Common Stock,$13.39,0.69,5.433%,240601563.00,United States,2020,126171,Health Care,Hospital/Nursing Management
DFHTU,Deerfield Healthcare Technology Acquisitions Corp. Unit,$12.421,-0.679,-5.183%,0.00,United States,2020,306,Health Care,Hospital/Nursing Management
DFHTW,Deerfield Healthcare Technology Acquisitions Corp. Warrant,$3.50,0.00,0.00%,0.00,United States,2020,7,Health Care,Hospital/Nursing Management
DFPH,DFP Healthcare Acquisitions Corp. Class A Common Stock,$10.25,0.00,0.00%,294687500.00,United States,2020,10,Finance,Business Services
DFPHW,DFP Healthcare Acquisitions Corp. Warrant,$1.50,0.00,0.00%,0.00,United States,2020,10,Finance,Business Services
DGICA,Donegal Group Inc. Class A Common Stock,$15.11,-0.06,-0.396%,457467036.00,United States,,26811,Finance,Property-Casualty Insurers
DGICB,Donegal Group Inc. Class B Common Stock,$14.3796,0.00,0.00%,435353606.00,United States,1986,10,Finance,Property-Casualty Insurers
DGII,Digi International Inc. Common Stock,$18.62,-0.36,-1.897%,618357278.00,United States,1989,83868,Technology,Computer Communications Equipment
DGLY,Digital Ally Inc. Common Stock,$1.78,0.05,2.89%,91707720.00,United States,,920091,Technology,Radio And Television Broadcasting And Communications Equipment
DGNS,Dragoneer Growth Opportunities Corp. II Class A Ordinary Shares,$10.40,0.12,1.167%,328432000.00,United States,2020,7450,Finance,Business Services
DGNU,Dragoneer Growth Opportunities Corp. III Class A Ordinary Shares,$10.30,-0.04,-0.387%,515000000.00,United States,2021,1114,Finance,Business Services
DHBCU,DHB Capital Corp. Unit,$9.96,-0.04,-0.40%,0.00,United States,2021,6114,Finance,Business Services
DHC,Diversified Healthcare Trust Common Shares of Beneficial Interest,$4.76,-0.03,-0.626%,1134157955.00,United States,,277983,Consumer Services,Real Estate Investment Trusts
DHCAU,DHC Acquisition Corp. Unit,$9.95,0.00,0.00%,0.00,United States,2021,3592,Finance,Business Services
DHCNI,Diversified Healthcare Trust 5.625% Senior Notes due 2042,$23.16,0.00,0.00%,0.00,United States,,12398,Consumer Services,Real Estate Investment Trusts
DHCNL,Diversified Healthcare Trust 6.25% Senior Notes Due 2046,$24.41,-0.12,-0.489%,0.00,United States,,10987,Consumer Services,Real Estate Investment Trusts
DHHC,DiamondHead Holdings Corp. Class A Common Stock,$9.80,0.05,0.513%,338100000.00,United States,2021,2339,Finance,Business Services
DHHCU,DiamondHead Holdings Corp. Unit,$9.91,-0.16,-1.589%,0.00,United States,2021,1234,Finance,Business Services
DHHCW,DiamondHead Holdings Corp. Warrant,$0.7986,0.0686,9.397%,0.00,United States,2021,16301,Finance,Business Services
DHIL,Diamond Hill Investment Group Inc. Class A Common Stock,$166.25,0.85,0.514%,525353159.00,United States,,1856,Finance,Investment Managers
DIOD,Diodes Incorporated Common Stock,$80.64,-2.05,-2.479%,3571007892.00,United States,,49357,Technology,Semiconductors
DISAU,Disruptive Acquisition Corporation I Unit,$9.9624,0.0424,0.427%,0.00,United States,2021,440,Finance,Business Services
DISCA,Discovery Inc. Series A Common Stock,$43.0528,-0.3272,-0.754%,20981101630.00,United States,,7164377,Consumer Services,Television Services
DISCB,Discovery Inc. Series B Common Stock,$85.60,-6.35,-6.906%,41715807092.00,United States,,28013,Consumer Services,Television Services
DISCK,Discovery Inc. Series C Common Stock,$36.43,-0.44,-1.193%,17753584724.00,United States,,2521409,Consumer Services,Television Services
DISH,DISH Network Corporation Class A Common Stock,$37.54,0.11,0.294%,19790264785.00,United States,1995,562190,Consumer Services,Television Services
DJCO,Daily Journal Corp. (S.C.) Common Stock,$329.00,0.00,0.00%,454265434.00,United States,,799,Consumer Services,Newspapers/Magazines
DKNG,DraftKings Inc. Class A Common Stock,$62.56,-1.24,-1.944%,24880424112.00,United States,2019,6260118,Consumer Services,Services-Misc. Amusement & Recreation
DLCA,Deep Lake Capital Acquisition Corp. Class A Ordinary Shares,$9.77,0.03,0.308%,252798750.00,United States,2021,11166,Finance,Business Services
DLCAU,Deep Lake Capital Acquisition Corp. Unit,$10.07,0.03,0.299%,0.00,United States,2021,9322,Finance,Business Services
DLCAW,Deep Lake Capital Acquisition Corp. Warrant,$0.70,0.05,7.692%,0.00,United States,2021,5192,Finance,Business Services
DLHC,DLH Holdings Corp.,$10.75,0.09,0.844%,134846990.00,United States,,10787,Technology,Professional Services
DLPN,Dolphin Entertainment Inc. Common Stock,$12.32,-0.37,-2.916%,80823413.00,United States,,989007,Consumer Services,Other Consumer Services
DLTH,Duluth Holdings Inc. Class B Common Stock,$16.485,-0.005,-0.03%,542557798.00,United States,2015,24384,Consumer Services,Clothing/Shoe/Accessory Stores
DLTR,Dollar Tree Inc. Common Stock,$116.91,-0.70,-0.595%,27289240342.00,United States,1995,340087,Consumer Services,Department/Specialty Retail Stores
DMAC,DiaMedica Therapeutics Inc. Common Stock,$9.30,-0.19,-2.002%,174273388.00,United States,2018,10000,Health Care,Major Pharmaceuticals
DMLP,Dorchester Minerals L.P. Common Units Representing Limited Partnership Interests,$14.18,0.27,1.941%,491759195.00,United States,,16128,Energy,Oil & Gas Production
DMRC,Digimarc Corporation Common Stock,$30.1972,-0.9728,-3.121%,508863405.00,United States,,19165,Technology,EDP Services
DMTK,DermTech Inc. Common Stock,$50.54,-1.19,-2.30%,1453311461.00,United States,2017,292982,Health Care,Medical Specialities
DNLI,Denali Therapeutics Inc. Common Stock,$53.615,-1.175,-2.145%,6486561717.00,United States,2017,78756,Health Care,Biotechnology: Biological Products (No Diagnostic Substances)
DOCU,DocuSign Inc. Common Stock,$206.205,0.495,0.241%,39815620310.00,United States,2018,696431,Technology,Computer Software: Prepackaged Software
DOGZ,Dogness (International) Corporation Class A Common Stock,$1.81,-0.03,-1.63%,53157457.00,China,2017,86048,Consumer Durables,Miscellaneous manufacturing industries
DOMO,Domo Inc. Class B Common Stock,$56.64,-1.24,-2.142%,1765106191.00,United States,2018,120722,Technology,Computer Software: Prepackaged Software
DOOO,BRP Inc. (Recreational Products) Common Subordinate Voting Shares,$86.30,-0.90,-1.032%,7306725595.00,Canada,,46072,Capital Goods,Industrial Specialties
DORM,Dorman Products Inc. Common Stock,$102.655,-1.085,-1.046%,3301241904.00,United States,,16044,Capital Goods,Auto Parts:O.E.M.
DOX,Amdocs Limited Ordinary Shares,$72.35,0.02,0.028%,9465188750.00,Guernsey,,330378,Technology,EDP Services
DOYU,DouYu International Holdings Limited ADS,$10.215,-0.415,-3.904%,3278469008.00,China,2019,1214162,Technology,Computer Software: Programming Data Processing
DRIO,DarioHealth Corp. Common Stock,$19.18,0.05,0.261%,292943601.00,Israel,,72370,Health Care,Medical/Dental Instruments
DRNA,Dicerna Pharmaceuticals Inc. Common Stock,$25.47,-0.67,-2.563%,1943893145.00,United States,2014,128898,Health Care,Major Pharmaceuticals
DRRX,DURECT Corporation Common Stock,$1.84,-0.06,-3.158%,418051428.00,United States,2000,363577,Health Care,Major Pharmaceuticals
DRTT,DIRTT Environmental Solutions Ltd. Common Shares,$3.215,-0.125,-3.743%,272250585.00,Canada,,33260,Technology,Computer Software: Prepackaged Software
DRVN,Driven Brands Holdings Inc. Common Stock,$25.14,-0.19,-0.75%,4208693760.00,United States,2021,198279,Consumer Services,Automotive Aftermarket
DSAC,Duddell Street Acquisition Corp. Class A Ordinary Shares,$10.01,0.03,0.301%,218968750.00,Hong Kong,2020,102233,Finance,Business Services
DSACU,Duddell Street Acquisition Corp. Unit,$10.75,0.0618,0.578%,0.00,Hong Kong,2020,339,Finance,Business Services
DSACW,Duddell Street Acquisition Corp. Warrant,$1.71,0.00,0.00%,0.00,Hong Kong,2020,43,Finance,Business Services
DSEY,Diversey Holdings Ltd. Ordinary Shares,$14.875,-0.025,-0.168%,4522124310.00,United States,2021,214356,Consumer Durables,Specialty Chemicals
DSGN,Design Therapeutics Inc. Common Stock,$29.76,-0.02,-0.067%,1655171503.00,United States,2021,102866,Health Care,Major Pharmaceuticals
DSGX,Descartes Systems Group Inc. (The) Common Stock,$62.95,0.41,0.656%,5319108686.00,Canada,,32199,Technology,Computer Software: Prepackaged Software
DSKE,Daseke Inc. Common Stock,$8.44,0.02,0.238%,548843325.00,United States,2015,97819,Consumer Services,Transportation Services
DSKEW,Daseke Inc. Warrant,$0.3001,-0.0094,-3.037%,0.00,United States,2015,29803,Consumer Services,Transportation Services
DSP,Viant Technology Inc. Class A Common Stock,$41.47,-0.61,-1.45%,2444057632.00,United States,2021,116872,Technology,Computer Software: Programming Data Processing
DSPG,DSP Group Inc. Common Stock,$14.63,-0.10,-0.679%,354426512.00,United States,1994,26283,Technology,Semiconductors
DSWL,Deswell Industries Inc. Common Shares,$3.6557,0.0557,1.547%,58181339.00,Macau,1995,18897,Consumer Non-Durables,Plastic Products
DTEA,DAVIDsTEA Inc. Common Stock,$3.72,0.01,0.27%,97578974.00,Canada,2015,35375,Consumer Non-Durables,Food Chains
DTIL,Precision BioSciences Inc. Common Stock,$9.10,-0.13,-1.408%,518574311.00,United States,2019,226973,Health Care,Biotechnology: Biological Products (No Diagnostic Substances)
DTOCU,Digital Transformation Opportunities Corp. Units,$9.99,0.00,0.00%,0.00,United States,2021,28443,Finance,Business Services
DTSS,Datasea Inc. Common Stock,$3.3841,0.0241,0.717%,72658136.00,China,,26435,Technology,Computer Software: Prepackaged Software
DUNE,Dune Acquisition Corporation Class A Common Stock,$9.76,0.00,0.00%,,United States,2021,22568,Finance,Business Services
DUNEU,Dune Acquisition Corporation Unit,$10.08,0.02,0.199%,0.00,United States,2020,28691,Finance,Business Services
DUNEW,Dune Acquisition Corporation Warrant,$0.66,-0.03,-4.348%,0.00,United States,2021,29328,Finance,Business Services
DUO,Fangdd Network Group Ltd. American Depositary Shares,$6.02,-0.27,-4.293%,480677513.00,China,2019,24555,Finance,Real Estate
DUOT,Duos Technologies Group Inc. Common Stock,$11.00,-0.32,-2.827%,38874165.00,United States,,14138,Technology,Computer Software: Prepackaged Software
DVAX,Dynavax Technologies Corporation Common Stock,$9.94,-0.18,-1.779%,1125765644.00,United States,2004,593528,Health Care,Major Pharmaceuticals
DWSN,Dawson Geophysical Company Common Stock,$2.46,-0.01,-0.405%,57756057.00,United States,,8668,Energy,Oil & Gas Production
DXCM,DexCom Inc. Common Stock,$371.79,-1.21,-0.324%,35757781790.00,United States,2005,105211,Health Care,Medical/Dental Instruments
DXPE,DXP Enterprises Inc. Common Stock,$30.28,-0.35,-1.143%,584200518.00,United States,,8428,Capital Goods,Industrial Machinery/Components
DXYN,Dixie Group Inc. (The) Common Stock,$3.54,-0.10,-2.747%,55273312.00,United States,,20983,Consumer Durables,Home Furnishings
DYAI,Dyadic International Inc. Common Stock,$5.07,-0.23,-4.34%,139699576.00,United States,,113526,Health Care,Biotechnology: Biological Products (No Diagnostic Substances)
DYN,Dyne Therapeutics Inc. Common Stock,$16.38,-0.07,-0.426%,842700271.00,United States,2020,33652,Health Care,Major Pharmaceuticals
DYNT,Dynatronics Corporation Common Stock,$1.135,-0.025,-2.155%,16996067.00,United States,,118178,Health Care,Medical/Dental Instruments
DZSI,DZS Inc. Common Stock,$15.07,-0.09,-0.594%,404482191.00,United States,,54388,Public Utilities,Telecommunications Equipment
EA,Electronic Arts Inc. Common Stock,$141.66,0.38,0.269%,40745102985.00,United States,,765657,Technology,Computer Software: Prepackaged Software
EAC,Edify Acquisition Corp. Class A Common Stock,$9.74,-0.01,-0.103%,336030000.00,United States,2021,75375,Finance,Business Services
EACPU,Edify Acquisition Corp. Units,$9.99,-0.01,-0.10%,0.00,United States,2021,21476,Finance,Business Services
EACPW,Edify Acquisition Corp. Warrant,$0.70,0.12,20.69%,0.00,United States,2021,73797,Finance,Business Services
EAR,Eargo Inc. Common Stock,$51.07,-3.88,-7.061%,1955747202.00,United States,2020,184385,Health Care,Industrial Specialties
EARS,Auris Medical Holding Ltd. Common Shares 0.01 SF (Bermuda),$3.26,-0.06,-1.807%,23111809.00,Bermuda,2014,285362,Health Care,Major Pharmaceuticals
EAST,Eastside Distilling Inc. Common Stock,$1.905,-0.145,-7.073%,21620325.00,United States,,95255,Consumer Non-Durables,Beverages (Production/Distribution)
EBACU,European Biotech Acquisition Corp. Units,$10.09,0.045,0.448%,0.00,Netherlands,2021,13124,Finance,Business Services
EBAY,eBay Inc. Common Stock,$61.575,-0.945,-1.512%,41898448103.00,United States,1998,1849191,Miscellaneous,Business Services
EBC,Eastern Bankshares Inc. Common Stock,$19.22,-0.165,-0.851%,3589491720.00,United States,2020,103969,Finance,Savings Institutions
EBIX,Ebix Inc. Common Stock,$31.00,-0.90,-2.821%,959839329.00,United States,,100442,Technology,EDP Services
EBMT,Eagle Bancorp Montana Inc. Common Stock,$23.20,-0.28,-1.193%,157190370.00,United States,,8588,Finance,Major Banks
EBON,Ebang International Holdings Inc. Class A Ordinary Shares,$5.44,-0.09,-1.627%,934784233.00,China,2020,16570490,Technology,Semiconductors
EBSB,Meridian Bancorp Inc. Common Stock,$18.45,-0.12,-0.646%,967105919.00,United States,,12860,Finance,Major Banks
EBTC,Enterprise Bancorp Inc Common Stock,$33.3956,-0.1044,-0.312%,399342147.00,United States,,4491,Finance,Major Banks
ECHO,Echo Global Logistics Inc. Common Stock,$31.99,-0.39,-1.204%,851193791.00,United States,2009,23652,Transportation,Oil Refining/Marketing
ECOL,US Ecology Inc Common Stock,$41.23,-1.07,-2.53%,1298725869.00,United States,,20361,Public Utilities,Environmental Services
ECOR,electroCore Inc. Common Stock,$2.02,-0.02,-0.98%,97923106.00,United States,2018,202178,Health Care,Biotechnology: Electromedical & Electrotherapeutic Apparatus
ECPG,Encore Capital Group Inc Common Stock,$38.75,0.05,0.129%,1214640799.00,United States,,67214,Finance,Finance Companies
EDAP,EDAP TMS S.A. American Depositary Shares,$9.32,-0.22,-2.306%,271599395.00,France,1997,49070,Health Care,Biotechnology: Electromedical & Electrotherapeutic Apparatus
EDIT,Editas Medicine Inc. Common Stock,$41.1289,-1.5111,-3.544%,2770557495.00,United States,2016,439979,Health Care,Biotechnology: Biological Products (No Diagnostic Substances)
EDRY,EuroDry Ltd. Common Shares ,$8.53,0.03,0.353%,19658494.00,Greece,,527,Consumer Services,Marine Transportation
EDSA,Edesa Biotech Inc. Common Shares,$5.675,-0.135,-2.324%,74787658.00,United States,,26933,Health Care,Major Pharmaceuticals
