Symbol,Name,Last Sale,Net Change,% Change,Market Cap,Country,IPO Year,Volume,Sector,Industry
INTZ,Intrusion Inc. Common Stock,$28.00,2.00,7.692%,491085812.00,United States,,171903,Technology,Computer Communications Equipment
INVA,Innoviva Inc. Common Stock,$12.26,-0.04,-0.325%,1243070787.00,United States,,84389,Health Care,Major Pharmaceuticals
INVE,Identiv Inc. Common Stock,$10.70,-0.23,-2.104%,194257494.00,United States,,37015,Technology,Computer peripheral equipment
INVO,INVO BioScience Inc. Common Stock,$4.265,0.065,1.548%,44442921.00,United States,,76482,Health Care,Medical/Dental Instruments
INVZ,Innoviz Technologies Ltd. Ordinary shares,$11.53,0.74,6.858%,0.00,Israel,,3133364,,
INVZW,Innoviz Technologies Ltd. Warrant,$3.03,0.13,4.483%,0.00,Israel,,140466,,
INZY,Inozyme Pharma Inc. Common Stock,$20.99,-0.21,-0.991%,492512089.00,United States,2020,689,Health Care,Major Pharmaceuticals
IONS,Ionis Pharmaceuticals Inc. Common Stock,$45.155,-2.095,-4.434%,6360633138.00,United States,,1148223,Health Care,Major Pharmaceuticals
IOSP,Innospec Inc. Common Stock,$104.28,-1.67,-1.576%,2590548683.00,United States,,5936,Basic Industries,Major Chemicals
IOVA,Iovance Biotherapeutics Inc. Common Stock,$31.29,-0.75,-2.341%,4598980826.00,United States,,246293,Health Care,Biotechnology: Biological Products (No Diagnostic Substances)
IPA,ImmunoPrecise Antibodies Ltd. Common Stock,$12.8922,0.5322,4.306%,245970284.00,Canada,,133674,Health Care,Major Pharmaceuticals
IPAR,Inter Parfums Inc. Common Stock,$71.12,-0.02,-0.028%,2249888170.00,United States,,8392,Consumer Non-Durables,Package Goods/Cosmetics
IPDN,Professional Diversity Network Inc. Common Stock,$2.195,-0.115,-4.978%,28139555.00,United States,2013,121286,Technology,Computer Software: Programming Data Processing
IPGP,IPG Photonics Corporation Common Stock,$222.88,-2.46,-1.092%,11931566985.00,United States,2006,98602,Technology,Semiconductors
IPHA,Innate Pharma S.A. ADS,$4.33,0.13,3.095%,341945144.00,France,2019,19503,Health Care,Biotechnology: Biological Products (No Diagnostic Substances)
IPHI,Inphi Corporation Common Stock,$182.30,-1.00,-0.546%,9784536491.00,United States,2010,546881,Technology,Semiconductors
IPLDP,Interstate Power & Light Company Perp Prd Ser D,$26.40,-0.08,-0.302%,0.00,United States,,2446,Public Utilities,Power Generation
IPVIU,InterPrivate IV InfraTech Partners Inc. Units,$9.98,0.02,0.201%,0.00,United States,2021,300,Finance,Business Services
IPWR,Ideal Power Inc. Common Stock,$11.9703,-0.4597,-3.698%,70290152.00,United States,2013,33938,Energy,Industrial Machinery/Components
IQ,iQIYI Inc. American Depositary Shares,$17.51,-1.17,-6.263%,13820378739.00,China,2018,8362838,Consumer Services,Consumer Electronics/Video Chains
IRBT,iRobot Corporation Common Stock,$119.28,-3.37,-2.748%,3363593777.00,United States,2005,88663,Consumer Durables,Consumer Electronics/Appliances
IRCP,IRSA Propiedades Comerciales S.A. American Depositary Shares,$9.3899,-0.1101,-1.159%,295814827.00,Argentina,,13540,Consumer Services,Building operators
IRDM,Iridium Communications Inc Common Stock,$40.31,-0.60,-1.467%,5406017836.00,United States,,156672,Capital Goods,Telecommunications Equipment
IRIX,IRIDEX Corporation Common Stock,$7.05,-0.12,-1.674%,109423459.00,United States,1996,22974,Health Care,Biotechnology: Electromedical & Electrotherapeutic Apparatus
IRMD,iRadimed Corporation Common Stock,$23.63,-0.68,-2.797%,290906472.00,United States,2014,1341,Health Care,Medical/Dental Instruments
IROQ,IF Bancorp Inc. Common Stock,$22.00,0.20,0.917%,71288272.00,United States,2011,3013,Finance,Savings Institutions
IRTC,iRhythm Technologies Inc. Common Stock,$131.88,-1.30,-0.976%,3845707841.00,United States,2016,92892,Health Care,Medical/Dental Instruments
IRWD,Ironwood Pharmaceuticals Inc. Class A Common Stock,$10.525,-0.175,-1.636%,1694126892.00,United States,2010,380808,Health Care,Major Pharmaceuticals
ISBC,Investors Bancorp Inc. Common Stock,$14.44,-0.09,-0.619%,3572254345.00,United States,,452028,Finance,Major Banks
ISEE,IVERIC bio Inc. Common Stock,$6.25,0.12,1.958%,559797150.00,United States,2013,204331,Health Care,Major Pharmaceuticals
ISIG,Insignia Systems Inc. Common Stock,$6.97,0.62,9.764%,12225589.00,United States,1991,8684079,Consumer Services,Advertising
ISLE,Isleworth Healthcare Acquisition Corporation Common stock,$9.7702,0.0502,0.516%,0.00,United States,2021,9372,Finance,Business Services
ISLEW,Isleworth Healthcare Acquisition Corporation Warrant,$0.5207,0.0107,2.098%,0.00,United States,2021,20176,Finance,Business Services
ISNS,Image Sensing Systems Inc. Common Stock,$4.80,0.0082,0.171%,25692605.00,United States,1995,1787,Capital Goods,Industrial Machinery/Components
ISRG,Intuitive Surgical Inc. Common Stock,$761.29,-5.56,-0.725%,90120086588.00,United States,2000,84486,Health Care,Industrial Specialties
ISSC,Innovative Solutions and Support Inc. Common Stock,$6.28,-0.04,-0.633%,108278956.00,United States,2000,1277,Technology,EDP Services
ISTR,Investar Holding Corporation Common Stock,$20.49,-0.32,-1.538%,213003262.00,United States,2014,19648,Finance,Major Banks
ISUN,iSun Inc. Common Stock,$15.225,-0.775,-4.844%,129086441.00,United States,2016,527890,Technology,Semiconductors
ITAC,Industrial Tech Acquisitions Inc. Class A common stock,$10.04,0.01,0.10%,97164469.00,United States,2020,34813,Finance,Business Services
ITACU,Industrial Tech Acquisitions Inc. Unit,$11.26,-0.22,-1.916%,0.00,United States,2020,821,Finance,Business Services
ITACW,Industrial Tech Acquisitions Inc. Warrant,$1.21,0.0099,0.825%,0.00,United States,2020,87946,Finance,Business Services
ITCI,Intra-Cellular Therapies Inc. Common Stock,$31.60,0.30,0.958%,2556977611.00,United States,,126947,Health Care,Major Pharmaceuticals
ITHX,ITHAX Acquisition Corp. Class A Ordinary Shares,$9.87,0.12,1.231%,0.00,United States,2021,10113,Finance,Business Services
ITHXU,ITHAX Acquisition Corp. Unit,$10.00,-0.01,-0.10%,0.00,United States,2021,105,Finance,Business Services
ITHXW,ITHAX Acquisition Corp. Warrant,$0.55,0.00,0.00%,0.00,United States,2021,15,Finance,Business Services
ITI,Iteris Inc. Common Stock,$6.12,-0.18,-2.857%,254840423.00,United States,,29625,Capital Goods,Telecommunications Equipment
ITIC,Investors Title Company Common Stock,$168.50,-0.10,-0.059%,319159557.00,United States,,567,Finance,Specialty Insurers
ITMR,Itamar Medical Ltd. American Depository Shares,$23.915,-0.22,-0.912%,391897903.00,Israel,,12817,Health Care,Medical/Dental Instruments
ITOS,iTeos Therapeutics Inc. Common Stock,$31.50,-3.04,-8.801%,1105618469.00,United States,2020,68132,Health Care,Biotechnology: Biological Products (No Diagnostic Substances)
ITQ,Itiquira Acquisition Corp. Class A Ordinary Shares,$9.77,0.12,1.244%,0.00,United States,2021,1681,Finance,Business Services
ITQRU,Itiquira Acquisition Corp. Unit,$9.99,-0.01,-0.10%,0.00,United States,2021,13224,Finance,Business Services
ITQRW,Itiquira Acquisition Corp. Warrant,$0.54,-0.43,-44.33%,0.00,United States,2021,53193,Finance,Business Services
ITRI,Itron Inc. Common Stock,$91.87,-1.96,-2.089%,4145329109.00,United States,1993,163891,Capital Goods,Electrical Products
ITRM,Iterum Therapeutics plc Ordinary Share,$1.5126,-0.0474,-3.038%,266940567.00,Ireland,2018,3840167,Health Care,Major Pharmaceuticals
ITRN,Ituran Location and Control Ltd. Ordinary Shares,$22.09,0.09,0.409%,518572271.00,Israel,2005,210940,Technology,Electronic Components
IVA,Inventiva S.A. American Depository Shares,$14.765,-0.375,-2.477%,570375804.00,France,2020,5199,Health Care,Major Pharmaceuticals
IVAC,Intevac Inc. Common Stock,$7.40,-0.37,-4.762%,178263195.00,United States,1995,87885,Technology,Industrial Machinery/Components
IZEA,IZEA Worldwide Inc. Common Stock,$4.91,0.34,7.44%,290325305.00,United States,,5337955,Consumer Services,Advertising
JACK,Jack In The Box Inc. Common Stock,$112.69,-0.36,-0.318%,2572472670.00,United States,,48668,Consumer Services,Restaurants
JAGX,Jaguar Health Inc. Common Stock,$1.91,-0.06,-3.046%,244305382.00,United States,2015,3129688,Health Care,Major Pharmaceuticals
JAKK,JAKKS Pacific Inc. Common Stock,$7.16,-0.11,-1.513%,43515244.00,United States,1996,17389,Consumer Non-Durables,Recreational Products/Toys
JAMF,Jamf Holding Corp. Common Stock,$36.79,0.35,0.96%,4321516858.00,United States,2020,112049,Technology,Computer Software: Prepackaged Software
JAN,JanOne Inc. Common Stock (NV),$9.15,0.29,3.273%,21991202.00,United States,,721106,Consumer Services,Home Furnishings
JAZZ,Jazz Pharmaceuticals plc Common Stock (Ireland),$161.61,-1.14,-0.70%,9102753712.00,Ireland,2007,91230,Health Care,Major Pharmaceuticals
JBHT,J.B. Hunt Transport Services Inc. Common Stock,$168.66,-0.64,-0.378%,17828206312.00,United States,,74696,Transportation,Trucking Freight/Courier Services
JBLU,JetBlue Airways Corporation Common Stock,$21.03,-0.22,-1.035%,6658873713.00,United States,2002,2768851,Transportation,Air Freight/Delivery Services
JBSS,John B. Sanfilippo & Son Inc. Common Stock,$89.84,-0.89,-0.981%,1030106608.00,United States,1991,7054,Consumer Non-Durables,Specialty Foods
JCIC,Jack Creek Investment Corp. Class A Ordinary Shares,$9.80,0.05,0.513%,422625000.00,United States,2021,16112,Finance,Business Services
JCICU,Jack Creek Investment Corp. Units,$10.10,0.06,0.598%,0.00,United States,2021,13460,Finance,Business Services
JCICW,Jack Creek Investment Corp. Warrants,$0.65,0.04,6.557%,0.00,United States,2021,20228,Finance,Business Services
JCOM,j2 Global Inc. Common Stock,$120.32,-1.09,-0.898%,5432383148.00,United States,1999,43896,Technology,Telecommunications Equipment
JCS,Communications Systems Inc. Common Stock,$5.81,-0.14,-2.353%,54193205.00,United States,,12205,Public Utilities,Telecommunications Equipment
JCTCF,Jewett-Cameron Trading Company Common Shares,$10.21,-0.18,-1.732%,35624334.00,United States,,1202,Consumer Services,RETAIL: Building Materials
JD,JD.com Inc. American Depositary Shares,$81.39,-2.12,-2.539%,126296891805.00,China,2014,4119982,Consumer Services,Other Specialty Stores
JFIN,Jiayin Group Inc. American Depositary Shares,$7.29,-0.52,-6.658%,393842250.00,China,2019,334496,Finance,Finance: Consumer Services
JFU,9F Inc. American Depositary Shares,$1.72,-0.05,-2.825%,335728520.00,China,2019,374331,Finance,Finance: Consumer Services
JG,Aurora Mobile Limited American Depositary Shares,$4.085,-0.075,-1.803%,472728565.00,China,2018,245400,Technology,Computer Software: Programming Data Processing
JJSF,J & J Snack Foods Corp. Common Stock,$156.16,-1.26,-0.80%,2963860114.00,United States,1986,13989,Consumer Non-Durables,Specialty Foods
JKHY,Jack Henry & Associates Inc. Common Stock,$155.21,-0.11,-0.071%,11807952921.00,United States,1985,74828,Technology,EDP Services
JMPNL,JMP Group LLC 7.25% Senior Notes due 2027,$25.3001,0.04,0.158%,0.00,United States,,519,Finance,Investment Bankers/Brokers/Service
JMPNZ,JMP Group LLC 6.875% Senior Notes due 2029,$24.7797,-0.0188,-0.076%,0.00,United States,,5182,Finance,Investment Bankers/Brokers/Service
JNCE,Jounce Therapeutics Inc. Common Stock,$10.3952,-0.1548,-1.467%,531647545.00,United States,2017,91455,Health Care,Biotechnology: Biological Products (No Diagnostic Substances)
JOAN,JOANN Inc. Common Stock,$13.06,0.91,7.49%,527246958.00,United States,2021,959347,Consumer Services,Other Specialty Stores
JOBS,51job Inc. American Depositary Shares,$64.00,0.00,0.00%,4314026048.00,China,2004,91190,Technology,Diversified Commercial Services
JOFF,JOFF Fintech Acquisition Corp. Class A Common Stock,$9.75,-0.01,-0.102%,0.00,United States,2021,57414,Finance,Business Services
JOFFU,JOFF Fintech Acquisition Corp. Unit,$9.96,-0.02,-0.20%,0.00,United States,2021,110210,Finance,Business Services
JOFFW,JOFF Fintech Acquisition Corp. Warrant,$0.83,-0.03,-3.488%,0.00,United States,2021,362288,Finance,Business Services
JOUT,Johnson Outdoors Inc. Class A Common Stock,$147.59,-2.11,-1.409%,1492455465.00,United States,,3769,Consumer Non-Durables,Recreational Products/Toys
JRJC,China Finance Online Co. Limited American Depositary Shares,$12.6954,-0.7646,-5.681%,31001659.00,China,2004,13005,Finance,Investment Bankers/Brokers/Service
JRSH,Jerash Holdings (US) Inc. Common Stock,$6.7201,0.0301,0.45%,76105133.00,United States,2018,1641,Consumer Non-Durables,Apparel
JRVR,James River Group Holdings Ltd. Common Shares,$46.87,-0.26,-0.552%,1441979454.00,Bermuda,2014,11577,Finance,Property-Casualty Insurers
JSM,Navient Corporation 6% Senior Notes due December 15 2043,$24.497,0.0569,0.233%,0.00,United States,,8441,Finance,Finance: Consumer Services
JUPW,Jupiter Wellness Inc. Common Stock,$4.83,-0.05,-1.025%,44350668.00,United States,2020,13577,Consumer Non-Durables,Package Goods/Cosmetics
JUPWW,Jupiter Wellness Inc. Warrant,$2.04,-0.04,-1.923%,0.00,United States,2020,15433,Consumer Non-Durables,Package Goods/Cosmetics
JVA,Coffee Holding Co. Inc. Common Stock,$5.4071,0.1271,2.407%,30866966.00,United States,2005,105687,Consumer Non-Durables,Packaged Foods
JWEL,Jowell Global Ltd. Ordinary Shares,$7.96,-0.59,-6.901%,197915140.00,China,2021,3012150,Consumer Services,Other Consumer Services
JYAC,Jiya Acquisition Corp. Class A Common Stock,$9.94,0.01,0.101%,136446778.00,United States,2020,279,Finance,Business Services
JYNT,The Joint Corp. Common Stock,$46.07,-0.43,-0.925%,651424778.00,United States,2014,44144,Miscellaneous,Multi-Sector Companies
KAIIU,Kismet Acquisition Two Corp. Unit,$10.00,-0.01,-0.10%,0.00,United States,2021,23482,Finance,Business Services
KAIR,Kairos Acquisition Corp. Class A Ordinary Shares,$9.81,0.00,0.00%,0.00,United States,2021,2,Finance,Business Services
KAIRU,Kairos Acquisition Corp. Unit,$10.10,0.00,0.00%,0.00,United States,2021,302,Finance,Business Services
KAIRW,Kairos Acquisition Corp. Warrant,$0.60,0.00,0.00%,0.00,United States,2021,1000,Finance,Business Services
KALA,Kala Pharmaceuticals Inc. Common Stock,$7.13,0.00,0.00%,399706837.00,United States,2017,384970,Health Care,Major Pharmaceuticals
KALU,Kaiser Aluminum Corporation Common Stock,$109.71,-0.73,-0.661%,1734753061.00,United States,,10338,Capital Goods,Metal Fabrications
KALV,KalVista Pharmaceuticals Inc. Common Stock,$26.23,-0.56,-2.09%,637603850.00,United Kingdom,2015,177491,Health Care,Major Pharmaceuticals
KARO,Karooooo Ltd. Ordinary Shares,$33.58,-1.68,-4.765%,766728581.00,Singapore,2021,57730,Technology,Computer Software: Prepackaged Software
KBAL,Kimball International Inc. Class B Common Stock,$13.61,-0.30,-2.157%,501962822.00,United States,,34465,Consumer Durables,Home Furnishings
KBNT,Kubient Inc. Common Stock,$7.65,0.13,1.729%,106132352.00,United States,2020,317160,Technology,EDP Services
KBNTW,Kubient Inc. Warrant,$3.105,0.045,1.471%,0.00,United States,2020,507,Technology,EDP Services
KBSF,KBS Fashion Group Limited Common Stock,$3.801,0.141,3.852%,9849527.00,China,2013,241844,Consumer Non-Durables,Apparel
KC,Kingsoft Cloud Holdings Limited American Depositary Shares,$44.77,-0.55,-1.214%,9967648404.00,China,2020,481785,Technology,Computer Software: Prepackaged Software
KCAPL,KCAP Financial Inc. 6.125% Notes due 2022,$25.25,0.00,0.00%,0.00,United States,,756,,
KDMN,Kadmon Holdings Inc. Common Stock,$3.835,-0.025,-0.648%,658917984.00,United States,,451198,Health Care,Major Pharmaceuticals
KDNY,Chinook Therapeutics Inc. Common Stock,$14.96,0.13,0.877%,630690143.00,United States,2015,37923,Health Care,Major Pharmaceuticals
KDP,Keurig Dr Pepper Inc. Common Stock,$35.175,0.105,0.299%,49500626293.00,United States,,1430101,Consumer Non-Durables,Beverages (Production/Distribution)
KE,Kimball Electronics Inc. Common Stock,$25.22,-0.74,-2.851%,629417078.00,United States,,62820,Technology,Electrical Products
KELYA,Kelly Services Inc. Class A Common Stock,$22.72,-0.62,-2.656%,892932375.00,United States,,35080,Technology,Professional Services
KELYB,Kelly Services Inc. Class B Common Stock,$31.75,-7.25,-18.59%,1247825832.00,United States,,48377,Technology,Professional Services
KEQU,Kewaunee Scientific Corporation Common Stock,$12.36,0.16,1.311%,34148171.00,United States,,383,Capital Goods,Medical Specialities
KERN,Akerna Corp. Common Stock,$4.95,-0.23,-4.44%,69590600.00,United States,2018,252719,Technology,EDP Services
KERNW,Akerna Corp Warrant,$1.295,-0.025,-1.894%,0.00,United States,2018,1812,Technology,EDP Services
KFFB,Kentucky First Federal Bancorp Common Stock,$7.21,0.00,0.00%,59440790.00,United States,,15079,Finance,Savings Institutions
KFRC,Kforce Inc. Common Stock,$54.50,0.21,0.387%,1203743081.00,United States,1995,55869,Technology,Professional Services
KHC,The Kraft Heinz Company Common Stock,$40.47,-0.23,-0.565%,49499523339.00,United States,,1089369,Consumer Non-Durables,Packaged Foods
KIDS,OrthoPediatrics Corp. Common Stock,$50.99,-1.31,-2.505%,1002378502.00,United States,2017,17812,Health Care,Medical/Dental Instruments
KIIIU,Kismet Acquisition Three Corp. Unit,$9.98,0.00,0.00%,0.00,United States,2021,2,Finance,Business Services
KIN,Kindred Biosciences Inc. Common Stock,$5.065,-0.385,-7.064%,209940289.00,United States,2013,156108,Health Care,Major Pharmaceuticals
KINS,Kingstone Companies Inc. Common Stock,$8.1053,-0.1547,-1.873%,86738114.00,United States,,493,Finance,Property-Casualty Insurers
KINZ,KINS Technology Group Inc. Class A Common Stock,$9.88,0.00,0.00%,340860000.00,United States,2021,1,Finance,Business Services
KINZU,KINS Technology Group Inc. Unit,$10.08,0.00,0.00%,0.00,United States,2020,14,Finance,Business Services
KINZW,KINS Technology Group Inc. Warrant,$0.80,0.039,5.125%,0.00,United States,2021,10984,Finance,Business Services
KIRK,Kirkland's Inc. COMMONSTOCK,$27.6499,-1.3601,-4.688%,395262427.00,United States,2002,191467,Consumer Services,Other Specialty Stores
KLAC,KLA Corporation Common Stock,$345.1595,-1.4405,-0.416%,53180329502.00,United States,1980,365869,Capital Goods,Electronic Components
KLAQ,KL Acquisition Corp Class A Common Stock,$9.73,0.00,0.00%,349671875.00,United States,2021,6,Finance,Business Services
KLAQU,KL Acquisition Corp Unit,$9.99,-0.01,-0.10%,0.00,United States,2021,149,Finance,Business Services
KLAQW,KL Acquisition Corp Warrant,$0.73,0.06,8.955%,0.00,United States,2021,101,Finance,Business Services
KLDO,Kaleido Biosciences Inc. Common Stock,$8.29,-0.43,-4.931%,352049697.00,United States,2019,141928,Health Care,Biotechnology: Biological Products (No Diagnostic Substances)
KLIC,Kulicke and Soffa Industries Inc. Common Stock,$54.80,-1.42,-2.526%,3401818888.00,Singapore,,749452,Technology,Semiconductors
KLXE,KLX Energy Services Holdings Inc. Common Stock,$15.05,-0.69,-4.384%,128077276.00,United States,,24052,Energy,Oilfield Services/Equipment
KMDA,Kamada Ltd. Ordinary Shares,$6.1818,-0.0182,-0.294%,276606891.00,Israel,2013,23025,Health Care,Major Pharmaceuticals
KMPH,KemPharm Inc. Common Stock,$9.985,0.185,1.888%,283337565.00,United States,,719927,Health Care,Major Pharmaceuticals
KNDI,Kandi Technologies Group Inc Common Stock,$6.31,-0.01,-0.158%,475695472.00,China,,854476,Capital Goods,Auto Manufacturing
KNSA,Kiniksa Pharmaceuticals Ltd. Class A Common Stock,$17.97,0.08,0.447%,1226134503.00,United States,2018,85766,Health Care,Major Pharmaceuticals
KNSL,Kinsale Capital Group Inc. Common Stock,$166.48,-3.79,-2.226%,3791271348.00,United States,2016,15594,Finance,Property-Casualty Insurers
KNTE,Kinnate Biopharma Inc. Common Stock,$30.21,-0.30,-0.983%,1313453432.00,United States,2020,42577,Health Care,Major Pharmaceuticals
KOD,Kodiak Sciences Inc Common Stock,$111.82,1.44,1.305%,5720982252.00,United States,2018,54853,Health Care,Biotechnology: Biological Products (No Diagnostic Substances)
KOPN,Kopin Corporation Common Stock,$10.80,-0.09,-0.826%,982639825.00,United States,1992,6904457,Technology,Semiconductors
KOR,Corvus Gold Inc. Common Shares,$1.95,-0.02,-1.015%,246934048.00,Canada,,28911,Basic Industries,Precious Metals
KOSS,Koss Corporation Common Stock,$21.75,-0.93,-4.101%,185240900.00,United States,,361875,Consumer Non-Durables,Consumer Electronics/Appliances
KPTI,Karyopharm Therapeutics Inc. Common Stock,$10.425,-0.045,-0.43%,778062484.00,United States,2013,228431,Health Care,Major Pharmaceuticals
KRBP,Kiromic BioPharma Inc. Common Stock,$9.49,-0.04,-0.42%,69590161.00,United States,2020,3496,Health Care,Biotechnology: Biological Products (No Diagnostic Substances)
KRKR,36Kr Holdings Inc. American Depositary Shares,$3.36,-0.09,-2.609%,125980982.00,China,2019,20038,Miscellaneous,Business Services
KRMD,Repro Med Systems Inc. Common Stock,$3.495,-0.075,-2.101%,155442079.00,United States,,61112,Health Care,Medical/Dental Instruments
KRNL,Kernel Group Holdings Inc. Class A Ordinary Shares,$9.70,0.09,0.937%,0.00,United States,2021,628,Finance,Business Services
KRNLU,Kernel Group Holdings Inc. Units,$10.015,0.045,0.451%,0.00,United States,2021,49198,Finance,Business Services
KRNLW,Kernel Group Holdings Inc. Warrants,$0.60,-0.01,-1.639%,0.00,United States,2021,38200,Finance,Business Services
KRNT,Kornit Digital Ltd. Ordinary Shares,$100.40,-7.62,-7.054%,4627302970.00,Israel,2015,50345,Capital Goods,Industrial Machinery/Components
KRNY,Kearny Financial Corp Common Stock,$12.25,-0.01,-0.082%,1031453197.00,United States,,53454,Finance,Savings Institutions
KRON,Kronos Bio Inc. Common Stock,$27.085,-0.975,-3.475%,1518051494.00,United States,2020,282669,Health Care,Major Pharmaceuticals
KROS,Keros Therapeutics Inc. Common Stock,$59.62,0.71,1.205%,1387400148.00,United States,2020,30593,Health Care,Major Pharmaceuticals
KRTX,Karuna Therapeutics Inc. Common Stock,$121.71,1.89,1.577%,3288450115.00,United States,2019,35551,Health Care,Major Pharmaceuticals
KRUS,Kura Sushi USA Inc. Class A Common Stock,$32.31,0.00,0.00%,270489175.00,United States,2019,8715,Consumer Services,Restaurants
KRYS,Krystal Biotech Inc. Common Stock,$73.63,-0.55,-0.741%,1634199590.00,United States,2017,29661,Health Care,Biotechnology: Biological Products (No Diagnostic Substances)
KSICU,Kadem Sustainable Impact Corporation Unit,$9.99,0.00,0.00%,0.00,United States,2021,80198,Finance,Business Services
KSMT,Kismet Acquisition One Corp Ordinary Shares,$9.89,-0.01,-0.101%,314007500.00,Russia,2020,20726,Finance,Business Services
KSMTU,Kismet Acquisition One Corp Unit,$10.12,0.00,0.00%,0.00,Russia,2020,52,Finance,Business Services
KSMTW,Kismet Acquisition One Corp Warrant,$0.77,-0.03,-3.75%,0.00,Russia,,1391,Finance,Business Services
KSPN,Kaspien Holdings Inc. Common Stock,$24.9178,0.1678,0.678%,61765047.00,United States,,14778,Consumer Services,Consumer Electronics/Video Chains
KTCC,Key Tronic Corporation Common Stock,$8.10,0.13,1.631%,87153408.00,United States,1983,51697,Technology,Electrical Products
KTOS,Kratos Defense & Security Solutions Inc. Common Stock,$28.10,-0.54,-1.885%,3469312998.00,United States,,425190,Capital Goods,Military/Government/Technical
KTRA,Kintara Therapeutics Inc. Common Stock,$1.7515,-0.0385,-2.151%,53641471.00,United States,,48671,Health Care,Major Pharmaceuticals
KURA,Kura Oncology Inc. Common Stock,$28.89,-0.82,-2.76%,1912842001.00,United States,,209065,Health Care,Major Pharmaceuticals
KURI,Alkuri Global Acquisition Corp. Class A common stock,$9.83,0.05,0.511%,423918750.00,United States,2021,7475,Finance,Business Services
KURIU,Alkuri Global Acquisition Corp. Unit,$9.9455,0.0055,0.055%,0.00,United States,2021,5680,Finance,Business Services
KURIW,Alkuri Global Acquisition Corp. Warrant,$0.99,-0.01,-1.00%,0.00,United States,2021,2251,Finance,Business Services
KVHI,KVH Industries Inc. Common Stock,$13.12,-0.31,-2.308%,241799501.00,United States,1996,21416,Technology,Radio And Television Broadcasting And Communications Equipment
KVSA,Khosla Ventures Acquisition Co. Class A Common Stock,$10.27,-0.01,-0.097%,467182300.00,United States,2021,42632,Finance,Business Services
KVSB,Khosla Ventures Acquisition Co. II Class A Common Stock,$10.2499,0.0799,0.786%,489272950.00,United States,2021,1125,Finance,Business Services
KVSC,Khosla Ventures Acquisition Co. III Class A Common Stock,$10.02,-0.05,-0.497%,564126000.00,United States,2021,11869,Finance,Business Services
KXIN,Kaixin Auto Holdings Ordinary Share,$2.91,-0.13,-4.276%,189534554.00,China,2017,920553,Consumer Durables,Automotive Aftermarket
KYMR,Kymera Therapeutics Inc. Common Stock,$35.02,-1.59,-4.343%,1569298205.00,United States,2020,81082,Health Care,Biotechnology: Biological Products (No Diagnostic Substances)
KZIA,Kazia Therapeutics Limited American Depositary Shares,$13.89,0.85,6.518%,175823454.00,Australia,,66857,Health Care,Major Pharmaceuticals
KZR,Kezar Life Sciences Inc. Common Stock,$6.27,-0.19,-2.941%,301375971.00,United States,2018,23810,Health Care,Major Pharmaceuticals
LABP,Landos Biopharma Inc. Common Stock,$9.67,-0.33,-3.30%,387937173.00,United States,2021,23531,Health Care,Major Pharmaceuticals
LACQ,Leisure Acquisition Corp. Common Stock,$12.85,-0.03,-0.233%,79981844.00,United States,2017,223,Finance,Business Services
LACQW,Leisure Acquisition Corp. Warrant,$0.821,0.016,1.988%,0.00,United States,2017,3985,Finance,Business Services
LAKE,Lakeland Industries Inc. Common Stock,$27.86,-0.65,-2.28%,223436643.00,United States,1986,52308,Health Care,Industrial Specialties
LAMR,Lamar Advertising Company Class A Common Stock,$96.86,-0.39,-0.401%,9774310265.00,United States,1996,96896,Consumer Services,Real Estate Investment Trusts
LANC,Lancaster Colony Corporation Common Stock,$177.75,-0.59,-0.331%,4896834750.00,United States,,15797,Consumer Non-Durables,Packaged Foods
LAND,Gladstone Land Corporation Common Stock,$18.45,-0.09,-0.485%,507964496.00,United States,1993,55272,Consumer Services,Real Estate Investment Trusts
LANDM,Gladstone Land Corporation 5.00% Series D Cumulative Term Preferred Stock,$25.50,-0.0995,-0.389%,614611353.00,United States,,5818,Consumer Services,Real Estate Investment Trusts
LANDO,Gladstone Land Corporation 6.00% Series B Cumulative Redeemable Preferred Stock,$25.9169,-0.0081,-0.031%,0.00,United States,,6546,Consumer Services,Real Estate Investment Trusts
LARK,Landmark Bancorp Inc. Common Stock,$26.30,0.14,0.535%,125039694.00,United States,,5038,Finance,Major Banks
